Sport,Date,Competition,Description
Football,24-Jan 12:30,England Premier League,West Ham United v Sunderland
Football,24-Jan 12:30,England League Two,Barnet v Oldham Athletic
Football,24-Jan 12:30,Albania Division 1,Burreli v KF Laci
Football,24-Jan 12:30,England Championship,Middlesbrough v Preston
Football,24-Jan 12:30,Philippines Football League,Maharlika Manila FC v Davao Aguilas FC
Football,24-Jan 12:30,England Championship,Millwall v Charlton Athletic
Football,24-Jan 12:30,England League One,Cardiff City v Stockport County
Football,24-Jan 12:30,England League Two,Notts County v Crewe Alexandra
Football,24-Jan 12:30,England Women's Super League,Chelsea F.C Women v Arsenal W.F.C
Football,24-Jan 12:30,Thailand Premier League,Port FC v Ratchaburi
Football,24-Jan 12:30,Thailand T2,Pattaya United v Bangkok FC
Football,24-Jan 12:30,Cyprus Division 2,MEAP Nisou v Ayia Napa
Football,24-Jan 12:30,Cyprus Division 2,AEZ Zakakiou v Halkanoras Idaliou
Football,24-Jan 13:00,Algeria Ligue 2,JS Bordj Menail v AS Khroub
Football,24-Jan 13:00,Germany Women's Division 1,Carl Zeiss Jena Women v VfL Wolfsburg Women
Football,24-Jan 13:00,CAF Champions League,Power Dynamos v Rivers United
Football,24-Jan 13:00,Italy Campionato Primavera 2,Modena U19 v Padova U19
Football,24-Jan 13:00,Spain Segunda Division,Real Valladolid CF v Albacete
Football,24-Jan 13:00,Uganda Premier League,NEC FC v Kitara FC
Football,24-Jan 13:00,Germany Bundesliga 3,Hoffenheim II v Alemannia Aachen
Football,24-Jan 13:00,Rwanda Premier League,Mukura Victory v Rayon Sports FC
Football,24-Jan 13:00,Germany Bundesliga 3,Erzgebirge Aue v SSV Ulm
Football,24-Jan 13:00,Germany Regionalliga Nordost,Meuselwitz v BFC Preussen
Football,24-Jan 13:00,Ireland Leinster Senior Cup,Athlone v Dundalk
Football,24-Jan 13:00,Algeria Ligue 2,JS El Biar v AsM Oran
Football,24-Jan 13:00,Club Friendly,SK Sigma Olomouc v Jeonbuk Motors
Football,24-Jan 13:00,Macau Primeira Divisao,Gala FC v Macau University
Football,24-Jan 13:00,Algeria Ligue 2,NRB Telaghema v MSP Batna
Football,24-Jan 13:00,Algeria Ligue 2,RC Kouba v MC Saida
Football,24-Jan 13:00,Algeria Ligue 2,MO Bejaia v HB Chelghoum Laid
Football,24-Jan 13:00,Algeria Ligue 1,MB Rouisset v JS Saoura
Football,24-Jan 13:00,Algeria Ligue 2,Bechar Djedid v USM El Harrach
Football,24-Jan 13:00,Algeria Ligue 2,JS Jijel v CR Beni Thour
Football,24-Jan 13:00,Spain Primera RFEF Group 2,Atletico Madrid B v Villarreal B
Football,24-Jan 13:00,Club Friendly,Biel-Bienne v Delemont
Football,24-Jan 13:00,Israel Premier League,Maccabi Netanya v Maccabi Haifa
Football,24-Jan 13:00,Club Friendly,Ilirija Extra-Lux v ND Beltinci
Football,24-Jan 13:00,Germany Bundesliga 3,Rot-Weiss Essen v TSV Havelse
Football,24-Jan 13:00,Club Friendly,HSK Posusje v NK Sesvete
Football,24-Jan 13:00,Germany Bundesliga 3,Cottbus v Schweinfurt
Football,24-Jan 13:00,Club Friendly,Mladost Zdralovi v NK Medimurec
Football,24-Jan 13:00,France Ligue 2,Guingamp v Troyes AC
Football,24-Jan 13:00,Club Friendly,CSK Uhersky Brod v Vsetin
Football,24-Jan 13:00,France Ligue 2,Red Star FC 93 v Boulogne
Football,24-Jan 13:00,Club Friendly,FK Eik Tonsberg 871 v Eidsvold
Football,24-Jan 13:00,Germany Bundesliga 3,Ingolstadt v Stuttgart II
Football,24-Jan 13:00,Ireland Leinster Senior Cup,Athlone v Dundalk
Football,24-Jan 13:00,Club Friendly,FK Inter Bratislava v FC Marchfeld Donauauen
Football,24-Jan 13:00,Club Friendly,Paide Linnameeskond v Rigas Futbola Skola
Football,24-Jan 13:00,Germany Women's Division 1,Carl Zeiss Jena Women v VfL Wolfsburg Women
Football,24-Jan 13:00,Kansallinen Cup,KuPS Women v IF Gnistan Women
Football,24-Jan 13:00,Club Friendly Women,Hammarby Women v Norrkoping Women
Football,24-Jan 13:00,Club Friendly,SK Sigma Olomouc v Jeonbuk Motors
Football,24-Jan 13:00,England Isthmian League Premier Division,Whitehawk v Canvey Island
Football,24-Jan 13:00,Spain Segunda Division,Real Valladolid CF v Albacete
Football,24-Jan 13:00,Spain Primera Division,Rayo Vallecano v Osasuna
Football,24-Jan 13:00,Germany Bundesliga 3,Erzgebirge Aue v SSV Ulm
Football,24-Jan 13:00,Algeria Ligue 2,Adrar v WA Mostaganem
Football,24-Jan 13:00,Germany Bundesliga 3,Hoffenheim II v Alemannia Aachen
Football,24-Jan 13:00,Algeria Ligue 2,NRB Beni Oulbene v US Chaouia
Football,24-Jan 13:00,Germany Regionalliga West,1. Fc Bocholt v FC Guthersloh 2000
Football,24-Jan 13:00,Algeria Ligue 2,NC Magra v Annaba
Football,24-Jan 13:00,Germany Regionalliga West,Mgladbach II v Bonner SC
Football,24-Jan 13:00,Algeria Ligue 2,Kolea v JSM Tiaret
Football,24-Jan 13:00,Club Friendly,Polonia Bytom v NKP Podhale Nowy Targ
Football,24-Jan 13:00,Germany Regionalliga West,Rot Weiss Oberhausen v Fortuna Dusseldorf II
Football,24-Jan 13:00,Club Friendly,Neman Grodno v FC Dinamo Brest
Football,24-Jan 13:00,Germany Regionalliga West,Sportfreunde Siegen v Borussia Dortmund II
Football,24-Jan 13:00,Club Friendly,Asker SK v Honefoss BK
Football,24-Jan 13:00,Germany Regionalliga West,Wuppertaler v SSVg Velbert 1902
Football,24-Jan 13:00,France Ligue 2,Guingamp v Troyes AC
Football,24-Jan 13:00,Greece Super League 2,Giannina v Iraklis
Football,24-Jan 13:00,Spain Primera Division,Rayo Vallecano v Osasuna
Football,24-Jan 13:00,Germany Bundesliga 3,Cottbus v Schweinfurt
Football,24-Jan 13:00,Germany Bundesliga 3,Ingolstadt v Stuttgart II
Football,24-Jan 13:00,Germany Bundesliga 3,Rot-Weiss Essen v TSV Havelse
Football,24-Jan 13:00,Spain Primera RFEF Group 2,Atletico Madrid B v Villarreal B
Football,24-Jan 13:00,Germany Regionalliga West,Sportfreunde Lotte v SV Rodinghausen
Football,24-Jan 13:00,Turkey 1. Lig,Belediye Vanspor v Igdir Belediyespor
Football,24-Jan 13:00,Israel Premier League,Maccabi Netanya v Maccabi Haifa
Football,24-Jan 13:00,France Ligue 2,Red Star FC 93 v Boulogne
Football,24-Jan 13:00,Finland Liigacup,FC Lahti v HJK Helsinki
Football,24-Jan 13:00,England Isthmian League Premier Division,Whitehawk v Canvey Island
Football,24-Jan 13:00,Algeria Ligue 1,ES Ben Aknoun v MC Oran
Football,24-Jan 13:00,Greece Super League 2,Makedonikos v Niki Volou
Football,24-Jan 13:00,Greece Super League 2,Anagennisi Karditsa v Chrisoupolis
Football,24-Jan 13:00,Greece Super League 2,Kavala v Asteras Tripolis B
Football,24-Jan 13:05,UAE Division 1,Emirates Club v Al Ittifaq FC
Football,24-Jan 13:10,UAE Division 1,Gulf United FC v Al Arabi (UAE)
Football,24-Jan 13:10,UAE Division 1,Dubai United v Al-Urooba
Football,24-Jan 13:10,Oman Elite League,Al Khaboora v Sur
Football,24-Jan 13:15,Club Friendly,Sparkasse Gleisdorf v SV Lebring
Football,24-Jan 13:15,Club Friendly,NK Jarun v NK Opatija
Football,24-Jan 13:25,Saudi Arabia Pro League,Al-Khaleej (KSA) v Al Shabab Riyadh
Football,24-Jan 13:30,Italy Campionato Primavera 2,Albinoleffe U19 v Udinese U19
Football,24-Jan 13:30,Italy Campionato Primavera 2,Albinoleffe U19 v Udinese U19
Football,24-Jan 13:30,Italy Campionato Primavera 2,FC Pro Vercelli 1892 U19 v Brescia U19
Football,24-Jan 13:30,Italy Campionato Primavera 2,Renate U19 v AC Reggiana 1919 U19
Football,24-Jan 13:30,Italy Campionato Primavera 2,Monopoli U19 v Empoli FC U19
Football,24-Jan 13:30,Italy Campionato Primavera 2,Avellino U19 v Ternana Calcio U19
Football,24-Jan 13:30,South Africa 1st Division,Casric Stars v Midlands Wanderers
Football,24-Jan 13:30,Italy Campionato Primavera 2,AS Bari U19 v AC Perugia U19
Football,24-Jan 13:30,South Africa 1st Division,Venda Academy v Upington City
Football,24-Jan 13:30,South Africa 1st Division,Pretoria University FC v Milford FC
Football,24-Jan 13:30,South Africa 1st Division,Kruger United v Baroka
Football,24-Jan 13:30,Italy Campionato Primavera 2,Vicenza U19 v Calcio Lecco 1912 U19
Football,24-Jan 13:30,Italy Campionato Primavera 2,US Catanzaro U19 v US Salernitana 1919 U19
Football,24-Jan 13:30,Netherlands Derde Divisie,FC Lisse v VV Noordwijk
Football,24-Jan 13:30,Campionato Primavera 3,Alcione Milano SS U19 v Mantova FC U19
Football,24-Jan 13:30,France Championnat National U19,Stade Rennais U19 v Brest U19
Football,24-Jan 13:30,Super League 2 U19,Nestos Chrisoupolis FC U19 v Panargiakos Argos FC U19
Football,24-Jan 13:30,Campionato Primavera 3,FC Arzignano Valchiampo U19 v Aurora Pro Patria 1919 U19
Football,24-Jan 13:30,France National 3,Sochaux II v Besancon Football
Football,24-Jan 13:30,Campionato Primavera 3,Carrarese Calcio U19 v US Triestina Calcio 1918 U19
Football,24-Jan 13:30,Campionato Primavera 4,Cavese 1919 U19 v Siracusa Calcio U19
Football,24-Jan 13:30,France Coupe de France Women,Nantes Women v Le Mans FC Women
Football,24-Jan 13:30,France National 3,FC Versailles 78 II v Sainte Genevieve Sports
Football,24-Jan 13:30,France National 3,Amiens SC II v Croix Football IC
Football,24-Jan 13:30,Club Friendly,Lyngby v Mjallby
Football,24-Jan 13:30,Greece First Division Women,OFI FC Women v Odysseas Glyfadas Women
Football,24-Jan 13:30,Italy Lega Pro Prima Divisione Girone A,Union Brescia v Renate
Football,24-Jan 13:30,Serie B Femminile,SSD ACF Calcio Femminile Arezzo Women v ASD Vicenza Calcio Femminile Women
Football,24-Jan 13:30,Italy Lega Pro Prima Divisione Girone A,Albinoleffe v AC Trento SCSD
Football,24-Jan 13:30,Italy Lega Pro Prima Divisione Girone C,Benevento v Siracusa
Football,24-Jan 13:30,Italy Lega Pro Prima Divisione Girone B,Sassari Torres v AC Bra
Football,24-Jan 13:30,Netherlands Tweede Divisie,Excelsior Maassluis v Katwijk
Football,24-Jan 13:30,Netherlands Tweede Divisie,Excelsior Maassluis v Katwijk
Football,24-Jan 13:30,Italy Lega Pro Prima Divisione Girone B,Carpi v Ternana
Football,24-Jan 13:30,Netherlands Tweede Divisie,ACV Assen v Sparta Rotterdam (Youth)
Football,24-Jan 13:30,Italy Lega Pro Prima Divisione Girone C,Latina v Foggia
Football,24-Jan 13:30,Netherlands Tweede Divisie,GVVV v De Treffers
Football,24-Jan 13:30,Netherlands Tweede Divisie,HHC v Rijnsburgse Boys
Football,24-Jan 13:30,South Africa Premier League,Orbit College v Chippa United
Football,24-Jan 13:30,Netherlands Tweede Divisie,Hoek v Spakenburg
Football,24-Jan 13:30,South Africa Premier League,Sekhukhune United v Orlando Pirates (SA)
Football,24-Jan 13:30,Netherlands Tweede Divisie,RKAV Volendam v Koninklijke HFC Haarlem
Football,24-Jan 13:45,U21 Divisie 2,NEC Nijmegen U21 v NAC Breda U21
Football,24-Jan 14:00,Italy Women's Serie A,Lazio Women v SSD Fiorentina WFC Women
Football,24-Jan 14:00,Iceland Reykjavik Cup,Throttur Reykjavik v Fylkir
Football,24-Jan 14:00,France National 2,Epinal v AS Furiani Agliani
Football,24-Jan 14:00,Netherlands Derde Divisie,ADO'20 v Sparta Nijkerk
Football,24-Jan 14:00,Iceland Reykjavik Cup,Valur Reykjavik v KR Reykjavik
Football,24-Jan 14:00,San Marino Campionato Sammarinese,FC Fiorentino v San Giovanni
Football,24-Jan 14:00,Iceland Reykjavik Cup,Vikingur Reykjavik v Fram Reykjavik
Football,24-Jan 14:00,Club Friendly,SC YF Juventus v FC Lugano II
Football,24-Jan 14:00,Uganda Premier League,Express FC v Buhimba Saints United
Football,24-Jan 14:00,Club Friendly,Harju JK Laagri v JK Welco Elekter
Football,24-Jan 14:00,Netherlands U21 Divisie 1,Willem II Tilburg U21 v Fortuna Sittard U21
Football,24-Jan 14:00,Club Friendly Women,Eskilstuna United DFF Women v Djurgardens IF Women
Football,24-Jan 14:00,Jordan League,Al Ramtha v Nadi Shabab Al Ordon
Football,24-Jan 14:00,U21 Divisie 4,VVV Venlo U21 v Helmond Sport U21
Football,24-Jan 14:00,San Marino Campionato Sammarinese,Juvenes-Dogana v Tre Fiori
Football,24-Jan 14:00,Italy Serie A,Como v Torino
Football,24-Jan 14:00,England Premier League 2,Aston Villa U21 v Ipswich U21
Football,24-Jan 14:00,Croatia 1. HNL,Nk Lokomotiva Zagreb v NK Vukovar '91
Football,24-Jan 14:00,Morocco Botola 2,Widad Temara v SCC Mohammedia
Football,24-Jan 14:00,Wales Cymru North,Denbigh Town v Newtown
Football,24-Jan 14:00,Wales Cymru North,Denbigh Town v Newtown
Football,24-Jan 14:00,Italy Eccellenza,ASD Castellammare Calcio 94 v ASD San Giorgio Piana 2014
Football,24-Jan 14:00,Wales Cymru North,Guilsfield FC v Ruthin Town FC
Football,24-Jan 14:00,Ireland Leinster Senior Cup,St Patrick's Athletic FC v Longford
Football,24-Jan 14:00,Italy Serie A,Como v Torino
Football,24-Jan 14:00,Morocco Championat National Professionnel Women,ASC Casablanca Women v FUS Rabat Women
Football,24-Jan 14:00,Club Friendly,Harju JK Laagri v JK Welco Elekter
Football,24-Jan 14:00,Club Friendly,IFK Norrkoping v Brommapojkarna
Football,24-Jan 14:00,Club Friendly,SC YF Juventus v FC Lugano II
Football,24-Jan 14:00,Club Friendly,Gefle IF v Sundsvall
Football,24-Jan 14:00,Turkey Division 2 Kirmizi,Fethiyespor v Aliaga FAS
Football,24-Jan 14:00,Club Friendly,Orgryte v Ljungskile
Football,24-Jan 14:00,Iceland Reykjavik Cup,Throttur Reykjavik v Fylkir
Football,24-Jan 14:00,Hungary NB I,Kisvarda FC v MTK Budapest
Football,24-Jan 14:00,Netherlands Derde Divisie,ADO'20 v Sparta Nijkerk
Football,24-Jan 14:00,Wales Cymru North,Caersws FC v Holyhead Hotspurs
Football,24-Jan 14:00,San Marino Campionato Sammarinese,FC Fiorentino v San Giovanni
Football,24-Jan 14:00,Wales Cymru North,Holywell Town v Mold
Football,24-Jan 14:00,Club Friendly Women,Eskilstuna United DFF Women v Djurgardens IF Women
Football,24-Jan 14:00,Wales Cymru South,Ynyshir Albions v Baglan Dragons
Football,24-Jan 14:00,Wales Cymru South,Llantwit Major v Treowen Stars
Football,24-Jan 14:00,Portugal Division 2,CS Maritimo v Felgueiras
Football,24-Jan 14:00,Turkey Division 2 Kirmizi,Bursaspor v Icel Idmanyurdu
Football,24-Jan 14:00,Cyprus Division 1,Digenis Akritas Ypsona v Ethnikos Ach.
Football,24-Jan 14:00,Italy Serie B,Cesena v Bari
Football,24-Jan 14:00,Netherlands Tweede Divisie,Kozakken Boys v Amsterdamsche FC
Football,24-Jan 14:00,Netherlands Tweede Divisie,Quick Boys v BVV Barendrecht
Football,24-Jan 14:10,Israel U19 Elite Division,Beitar Jerusalem Oren U19 v Maccabi Netanya U19
Football,24-Jan 14:15,Israel U19 Elite Division,Hapoel Petach Tikva U19 v Maccabi Haifa U19
Football,24-Jan 14:20,Israel U19 Elite Division,Hapoel Tel Aviv U19 v Maccabi Tel Aviv Shachar U19
Football,24-Jan 14:25,Oman Elite League,Sohar v Al Samail
Football,24-Jan 14:25,Oman Elite League,Sohar v Al Samail
Football,24-Jan 14:30,Italy Campionato Primavera 2,US Citta di Palermo U19 v AC Spezia Calcio U19
Football,24-Jan 14:30,Germany Bundesliga 1,Mainz 05 v Wolfsburg
Football,24-Jan 14:30,Iceland Reykjavik Cup,IR Reykjavik v Leiknir Reykjavik
Football,24-Jan 14:30,Club Friendly,Sundby BK v Nykobing FC
Football,24-Jan 14:30,Spain Division de Honor U19 - Group 3,Racing Club Zaragoza U19 v CF Damm U19
Football,24-Jan 14:30,Wales Premier League,Pen-y-Bont FC v Caernarfon Town
Football,24-Jan 14:30,Castilla y Leon Playoffs,CD San Jose de Soria v CD Cebrerena
Football,24-Jan 14:30,Wales Cymru South,Aberystwyth v Cardiff Draconians
Football,24-Jan 14:30,Germany Bundesliga 1,FC Heidenheim v RB Leipzig
Football,24-Jan 14:30,Germany Bundesliga 1,Bayern Munich v Augsburg
Football,24-Jan 14:30,Germany Bundesliga 1,Bayer Leverkusen v Werder Bremen
Football,24-Jan 14:30,Germany Bundesliga 1,Eintracht Frankfurt v Hoffenheim
Football,24-Jan 14:30,Wales Premier League,The New Saints v Barry Town
Football,24-Jan 14:45,Kuwait Premier League,Kuwait SC v Al Arabi (Kuwait)
Football,24-Jan 15:00,Northern Ireland Championship,Limavady United v Armagh City FC
Football,24-Jan 15:00,Scotland League Two,East Kilbride v Stranraer
Football,24-Jan 15:00,Portugal Campeonato Nacional Feminino,Valadares Gaia Women v Torreense Women
Football,24-Jan 15:00,Scotland League Two,Clyde v Spartans FC
Football,24-Jan 15:00,Portugal Campeonato Nacional Feminino,Vitoria Guimaraes SC Women v Sporting CP Women
Football,24-Jan 15:00,Scotland League One,Hamilton Academical v Cove Rangers
Football,24-Jan 15:00,Portugal Liga Revelacao U23,Rio Ave FC U23 v Estrela Amadora U23
Football,24-Jan 15:00,Scotland League One,Montrose v Peterhead
Football,24-Jan 15:00,Highland League Cup,Brechin City v Nairn County
Football,24-Jan 15:00,Scotland League One,Inverness CT v Alloa Athletic
Football,24-Jan 15:00,Scotland Lowland Football League,Civil Service Strollers FC v Bonnyrigg Rose
Football,24-Jan 15:00,Scotland League One,East Fife v Queen Of The South
Football,24-Jan 15:00,Scotland Lowland Football League,Gretna F.C. 2008 v Broxburn Athletic
Football,24-Jan 15:00,Scotland Championship,Raith Rovers v Queens Park FC
Football,24-Jan 15:00,Scotland Lowland Football League,Tranent Juniors v Hearts Colts
Football,24-Jan 15:00,Scotland Championship,Partick Thistle v Ayr United
Football,24-Jan 15:00,France National 3,ES Troyes AC II v US Ivry
Football,24-Jan 15:00,Scotland League Two,Edinburgh City v Annan Athletic
Football,24-Jan 15:00,Spain Division de Honor U19 - Group 7,Patacona U19 v Valencia U19
Football,24-Jan 15:00,Scotland League Two,Dumbarton v Elgin City
Football,24-Jan 15:00,Spain Division de Honor U19 - Group 7,Albacete Balompie U19 v Talavera U19
Football,24-Jan 15:00,Scotland Championship,St Johnstone v Dunfermline Athletic
Football,24-Jan 15:00,Spain Division de Honor U19 - Group 5,CD Badajoz U19 v Las Rozas Cf U19
Football,24-Jan 15:00,Scotland Premiership,Aberdeen v Livingston
Football,24-Jan 15:00,England Northern Premier League Division One West,Kidsgrove Ath v Vauxhall Motors
Football,24-Jan 15:00,England League Two,Walsall v Accrington Stanley
Football,24-Jan 15:00,England Northern Premier League Division One Midlands,Long Eaton v AFC Rushden & Diamonds
Football,24-Jan 15:00,England League Two,Salford City v Bristol Rovers
Football,24-Jan 15:00,Spain Division de Honor U19 - Group 7,UCAM Murcia U19 v CD Castellon U19
Football,24-Jan 15:00,England League Two,Newport County v Chesterfield
Football,24-Jan 15:00,England Isthmian League Division One South Central,Kingstonian v South Park
Football,24-Jan 15:00,England League Two,MK Dons v Shrewsbury Town
Football,24-Jan 15:00,Club Friendly,JaPS v PK-35
Football,24-Jan 15:00,England League Two,Harrogate Town v Gillingham
Football,24-Jan 15:00,England Isthmian League Division One North,Gorleston v Brantham Athletic
Football,24-Jan 15:00,England League Two,Colchester United v Fleetwood Town
Football,24-Jan 15:00,Morocco Botola Pro,Olympique Dcheira v DHJ El Jadida
Football,24-Jan 15:00,England League Two,Cheltenham Town v Grimsby Town
Football,24-Jan 15:00,England Southern Football League Division One Central,Barton Rovers v MK Irish FC
Football,24-Jan 15:00,England League Two,Cambridge United v Tranmere Rovers
Football,24-Jan 15:00,Spain Division de Honor U19 - Group 5,UD La Cruz Villanovense U19 v CD Leganes U19
Football,24-Jan 15:00,England League Two,Bromley v Swindon Town
Football,24-Jan 15:00,England Northern Premier League Division One East,Silsden AFC v Ashington
Football,24-Jan 15:00,England League Two,Barrow v Crawley Town
Football,24-Jan 15:00,England Southern Football League Division One Central,Leighton Town v Aylesbury United
Football,24-Jan 15:00,England League One,Rotherham v AFC Wimbledon
Football,24-Jan 15:00,England Premier League,Burnley v Tottenham Hotspur
Football,24-Jan 15:00,England Premier League,Burnley v Tottenham Hotspur
Football,24-Jan 15:00,England League One,Blackpool v Northampton Town
Football,24-Jan 15:00,England Premier League,Fulham v Brighton and Hove Albion
Football,24-Jan 15:00,England National League South,Chesham United v Maidenhead United
Football,24-Jan 15:00,England Premier League,Manchester City v Wolverhampton Wanderers
Football,24-Jan 15:00,England National League South,Weston Super Mare v Hornchurch
Football,24-Jan 15:00,Scotland Premiership,Dundee United v St Mirren
Football,24-Jan 15:00,England National League South,AFC Totton v Dover
Football,24-Jan 15:00,Scotland Premiership,Falkirk v Hibernian
Football,24-Jan 15:00,France Coupe de France Women,Marseille Women v Olympique Lyon Women
Football,24-Jan 15:00,Scotland Premiership,Motherwell v Kilmarnock
Football,24-Jan 15:00,England National League South,Eastbourne Borough FC v Farnborough
Football,24-Jan 15:00,Scotland Championship,Airdrieonians v Ross County
Football,24-Jan 15:00,Club Friendly,Haugesund v Vard Haugesund
Football,24-Jan 15:00,Scotland Championship,Partick Thistle v Ayr United
Football,24-Jan 15:00,England Southern Premier Central,Stourbridge v Redditch United
Football,24-Jan 15:00,Scotland Championship,Raith Rovers v Queens Park FC
Football,24-Jan 15:00,Spain Segunda B1,Real Oviedo II v Coruxo
Football,24-Jan 15:00,Scotland League One,East Fife v Queen Of The South
Football,24-Jan 15:00,England National League South,Dorking Wanderers v Chippenham
Football,24-Jan 15:00,Scotland League One,Montrose v Peterhead
Football,24-Jan 15:00,England National League South,Bath City v Worthing
Football,24-Jan 15:00,Scotland League One,Hamilton Academical v Cove Rangers
Football,24-Jan 15:00,England National League South,Ebbsfleet United v Dagenham & Redbridge
Football,24-Jan 15:00,Scotland League One,Inverness CT v Alloa Athletic
Football,24-Jan 15:00,England National League North,Marine FC v South Shields
Football,24-Jan 15:00,Scotland League Two,Clyde v Spartans FC
Football,24-Jan 15:00,England National League North,Chorley v Darlington
Football,24-Jan 15:00,Scotland League Two,East Kilbride v Stranraer
Football,24-Jan 15:00,England National League North,Radcliffe Boro v Buxton FC
Football,24-Jan 15:00,Northern Ireland Premiership,Ballymena v Portadown
Football,24-Jan 15:00,Northern Ireland Premiership,Ballymena v Portadown
Football,24-Jan 15:00,England Championship,Sheffield United v Ipswich Town
Football,24-Jan 15:00,Northern Ireland Premiership,Carrick Rangers v Dungannon Swifts
Football,24-Jan 15:00,England League One,Rotherham v AFC Wimbledon
Football,24-Jan 15:00,Northern Ireland Premiership,Crusaders v Linfield
Football,24-Jan 15:00,England League One,Blackpool v Northampton Town
Football,24-Jan 15:00,Romania Liga I,Universitatea Cluj v Unirea Slobozia
Football,24-Jan 15:00,England League Two,Barrow v Crawley Town
Football,24-Jan 15:00,England League One,Bolton Wanderers v Leyton Orient
Football,24-Jan 15:00,England League Two,Cambridge United v Tranmere Rovers
Football,24-Jan 15:00,England League One,Doncaster v Wigan Athletic
Football,24-Jan 15:00,England League Two,MK Dons v Shrewsbury Town
Football,24-Jan 15:00,England League One,Port Vale v Exeter City
Football,24-Jan 15:00,England League Two,Bromley v Swindon Town
Football,24-Jan 15:00,England League One,Reading v Barnsley
Football,24-Jan 15:00,England League Two,Cheltenham Town v Grimsby Town
Football,24-Jan 15:00,England League One,Stevenage v Mansfield Town
Football,24-Jan 15:00,England League Two,Salford City v Bristol Rovers
Football,24-Jan 15:00,England League One,Wycombe Wanderers v Peterborough United
Football,24-Jan 15:00,England League Two,Colchester United v Fleetwood Town
Football,24-Jan 15:00,Northern Ireland Championship,Annagh United v Newington YC
Football,24-Jan 15:00,England League Two,Harrogate Town v Gillingham
Football,24-Jan 15:00,Northern Ireland Championship,Dundela v Queen's University
Football,24-Jan 15:00,England League Two,Newport County v Chesterfield
Football,24-Jan 15:00,Northern Ireland Championship,Warrenpoint Town v Ballinamallard United
Football,24-Jan 15:00,England League Two,Walsall v Accrington Stanley
Football,24-Jan 15:00,Northern Ireland Championship,HW Welders v Loughgall
Football,24-Jan 15:00,Northern Ireland Championship,Ards FC v Institute
Football,24-Jan 15:00,England National League,Altrincham v Boreham Wood
Football,24-Jan 15:00,Belgium Division 1 B,Lokeren-Temse v KFCO Beerschot-Wilrijk
Football,24-Jan 15:00,England National League,Boston United FC v Southend
Football,24-Jan 15:00,England National League,Boston United FC v Southend
Football,24-Jan 15:00,Spain Segunda B1,Real Oviedo II v Coruxo
Football,24-Jan 15:00,England National League,Eastleigh v Halifax Town
Football,24-Jan 15:00,England National League,Aldershot Town v Carlisle
Football,24-Jan 15:00,England National League,Gateshead v Wealdstone
Football,24-Jan 15:00,England National League,Brackley Town v Hartlepool United
Football,24-Jan 15:00,England National League,Woking v Yeovil Town
Football,24-Jan 15:00,England National League,Morecambe v Solihull
Football,24-Jan 15:00,England National League,York City v Braintree Town
Football,24-Jan 15:00,England National League,Rochdale v Truro City
Football,24-Jan 15:00,Cyprus Division 1,Enosis v Olympiakos Nicosia
Football,24-Jan 15:00,England National League,Tamworth v Sutton United
Football,24-Jan 15:00,Portugal Liga 3,Atletico CP v Mafra
Football,24-Jan 15:00,Greece Super League,Olympiakos v Volos NFC
Football,24-Jan 15:00,England National League South,Slough Town v Tonbridge Angels
Football,24-Jan 15:00,Portugal Liga 3,1 Dezembro v Lusitano de Evora
Football,24-Jan 15:00,England National League South,Enfield Town v Torquay United
Football,24-Jan 15:00,Portugal Liga 3,UD Santarem v CF Os Belenenses
Football,24-Jan 15:00,England National League South,Maidstone United v Hemel Hempstead Town
Football,24-Jan 15:00,Portugal Liga 3,Amora v Covilha
Football,24-Jan 15:00,England National League South,Horsham F.C. v Chelmsford City
Football,24-Jan 15:00,Portugal Liga 3,Caldas v Academica
Football,24-Jan 15:00,England National League South,Salisbury FC v Hampton & Richmond
Football,24-Jan 15:00,England National League South,AFC Totton v Dover
Football,24-Jan 15:00,England National League North,Alfreton Town v Bedford Town FC
Football,24-Jan 15:00,England National League South,Bath City v Worthing
Football,24-Jan 15:00,England National League North,Leamington FC v Curzon Ashton
Football,24-Jan 15:00,England National League South,Chesham United v Maidenhead United
Football,24-Jan 15:00,England National League North,Hereford FC v Spennymoor Town
Football,24-Jan 15:00,England National League South,Dorking Wanderers v Chippenham
Football,24-Jan 15:00,England National League North,Oxford City v AFC Fylde
Football,24-Jan 15:00,Club Friendly,JaPS v PK-35
Football,24-Jan 15:00,England National League South,Eastbourne Borough FC v Farnborough
