Sport,Date,Competition,Description
Basketball,12-Jan 15:00,Adriatic League,BC Dubai v Borac Cacak
Basketball,12-Jan 15:00,Qatar Basketball League,Al Gharafa v Al Ahli
Boxing,10-Jan 15:00,Boxing Bouts,Kevin Saszik v Patrick Schaefer
Boxing,10-Jan 15:30,Boxing Bouts,Roman Fury v Toni Thes
Boxing,10-Jan 16:00,Boxing Bouts,Oronzo Birardi v Milosav Savic
Boxing,10-Jan 16:00,Boxing Bouts,Nelvie Raman Tiafack v Piotr Cwick
Boxing,10-Jan 16:00,Boxing Bouts,Daniel Dietz v Seun Salami
Boxing,10-Jan 19:00,Boxing Bouts,Gleb Bakshi v Juan Jose Rodriguez Duran
Boxing,10-Jan 19:30,Boxing Bouts,Granit Shala v Petar Milas
Boxing,10-Jan 20:30,Boxing Bouts,Jadier Herrera v Ricardo Nunez
Boxing,10-Jan 21:30,Boxing Bouts,Agit Kabayel v Damian Knyba
Boxing,10-Jan 22:00,Boxing Bouts,Keith Colon v Alberto Guevara
Boxing,10-Jan 22:00,Boxing Bouts,Arjan Iseni v Mario Bedolla Orozco
Boxing,10-Jan 23:00,Boxing Bouts,Nester Bravo v Pedro Campa
Boxing,10-Jan 23:00,Boxing Bouts,Emmanuel Rodriguez v Fernando Diaz
Boxing,11-Jan 00:00,Boxing Bouts,Djibril Diakite v Gregory Clark
Boxing,11-Jan 01:00,Boxing Bouts,Jeyvier Cintron v Victor Efrain Sandoval
Boxing,11-Jan 02:00,Boxing Bouts,Jeyvier Cintron v Jonathan Rodriguez
Boxing,11-Jan 02:30,Boxing Bouts,Alfredo Santiago v Hendri Cedeno
Boxing,11-Jan 03:00,Boxing Bouts,Subriel Matias v Dalton Smith
Boxing,11-Jan 04:00,Boxing Bouts,Subriel Matias v Dalton Smith
Cricket,09-Jan 06:30,Falcons Champions Trophy T20,AP XI v Royal Lions
Cricket,09-Jan 07:30,S.S. Rajan Trophy,Chengalpattu v Ranipet
Cricket,09-Jan 13:00,Bangladesh Premier League,Noakhali Express v Rangpur Riders
Cricket,09-Jan 13:00,ICCA Arabian Cricket League Phase 1,CSS Group v Dubai Gymkhana
Cricket,09-Jan 13:30,International Twenty20,Sri Lanka v Pakistan
Cricket,09-Jan 14:00,Womens Premier League,Mumbai Indians Women v Royal Challengers Bangalore Women
Cricket,09-Jan 14:30,Falcons Champions Trophy T20,Gujrat CC v AP XI
Cricket,09-Jan 16:30,SA20,Durban's Super Giants v Sunrisers Eastern Cape
Cricket,09-Jan 18:00,Falcons Champions Trophy T20,Tally Rangers v Stack CC B
Cricket,10-Jan 01:10,Women's Super Smash,Canterbury Magicians Women v Auckland Hearts Women
Cricket,10-Jan 04:55,New Zealand T20 Super Smash,Canterbury Kings v Auckland Aces
Cricket,10-Jan 05:00,Australia Twenty20 Big Bash,Brisbane Heat v Sydney Thunder
Cricket,10-Jan 06:00,WNCL,Western Australia Women v SA Scorpions
Cricket,10-Jan 07:30,U19 World Cup Warm-ups,India Under-19s v Scotland Under-19s
Cricket,10-Jan 07:30,Zimbabwe Domestic Twenty20 Competition,Matabeleland Tuskers v Mid West Rhinos
Cricket,10-Jan 08:15,Australia Twenty20 Big Bash,Melbourne Renegades v Melbourne Stars
Cricket,10-Jan 09:30,Womens Premier League,UP Warriorz v Gujarat Giants Women
Cricket,10-Jan 09:30,ICCA Arabian Cricket League Phase 1,Pharma Solutions v Dubai Wanderers
Cricket,10-Jan 11:00,SA20,Paarl Royals v Pretoria Capitals
Cricket,10-Jan 11:45,Zimbabwe Domestic Twenty20 Competition,Southern Rocks v Mashonaland Eagles
Cricket,10-Jan 13:00,ICCA Arabian Cricket League Phase 1,GHK Properties v CSS Group
Cricket,10-Jan 14:00,Womens Premier League,Mumbai Indians Women v Delhi Capitals Women
Cricket,10-Jan 15:30,SA20,Joburg Super Kings v MI Cape Town
Cricket,10-Jan 17:00,ICCA Arabian Cricket League Phase 1,Cosmic Titans v Dubai Dare Devils
Cricket,10-Jan 17:00,Falcons Champions Trophy T20,Al Hajery CC v Team TGS
Cricket,10-Jan 23:40,Women's Super Smash,Wellington Blaze Women v Northern Brave (W)
Cricket,11-Jan 03:00,Australia Twenty20 Big Bash,Sydney Sixers v Hobart Hurricanes
Cricket,11-Jan 03:25,New Zealand T20 Super Smash,Wellington Firebirds v Northern Brave
Cricket,11-Jan 04:00,Womens National Super League T20,Team Red (SLK) v Team Blues
Cricket,11-Jan 07:00,Bangladesh Premier League,Durbar Rajshahi v Rangpur Riders
Cricket,11-Jan 08:00,One Day International,India v New Zealand
Cricket,11-Jan 08:00,One Day International,India v New Zealand
Cricket,11-Jan 08:15,Australia Twenty20 Big Bash,Adelaide Strikers v Perth Scorchers
Cricket,11-Jan 08:30,Womens National Super League T20,Team Greys v Team Green (SLK)
Cricket,11-Jan 12:00,Bangladesh Premier League,Noakhali Express v Dhaka Capital
Cricket,11-Jan 13:00,ICCA Arabian Cricket League Phase 1,Alif Pharma v ZMI Holdings
Cricket,11-Jan 13:30,SA20,Sunrisers Eastern Cape v Durban's Super Giants
Cricket,11-Jan 13:30,International Twenty20,Sri Lanka v Pakistan
Cricket,11-Jan 14:00,Womens Premier League,Delhi Capitals Women v Gujarat Giants Women
Cricket,11-Jan 17:00,Falcons Champions Trophy T20,Trinity CC v Phoenix Riders
Cricket,11-Jan 17:00,ICCA Arabian Cricket League Phase 1,GHK Properties v Dubai Wanderers
Cricket,11-Jan 23:40,Women's Super Smash,Otago Sparks Women v Auckland Hearts Women
Cricket,12-Jan 03:25,New Zealand T20 Super Smash,Otago Volts v Auckland Aces
Cricket,12-Jan 03:30,Vijay Hazare Trophy,Karnataka v Mumbai
Cricket,12-Jan 03:30,Vijay Hazare Trophy,Uttar Pradesh v Saurashtra
Cricket,12-Jan 04:00,Womens National Super League T20,Team Red (SLK) v Team Green (SLK)
Cricket,12-Jan 07:00,Bangladesh Premier League,Sylhet Titans v Rangpur Riders
Cricket,12-Jan 08:15,Australia Twenty20 Big Bash,Sydney Thunder v Melbourne Renegades
Cricket,12-Jan 08:30,Womens National Super League T20,Team Greys v Team Blues
Cricket,12-Jan 12:00,Bangladesh Premier League,Durbar Rajshahi v Dhaka Capital
Cricket,12-Jan 13:30,SA20,Pretoria Capitals v MI Cape Town
Cricket,12-Jan 14:00,Womens Premier League,Royal Challengers Bangalore Women v UP Warriorz
Darts,09-Jan 14:05,Modus Super Series,Johnny Haines v Kevin Painter
Darts,09-Jan 14:15,Modus Super Series,Terry Jenkins v Martyn Turner
Darts,09-Jan 14:25,Modus Super Series,Michael Huntley v Robert Thornton
Darts,09-Jan 14:35,Modus Super Series,Terry Jenkins v Johnny Haines
Darts,09-Jan 14:45,Modus Super Series,Kevin Painter v Michael Huntley
Darts,09-Jan 14:55,Modus Super Series,Martyn Turner v Robert Thornton
Darts,09-Jan 15:05,Modus Super Series,Michael Huntley v Terry Jenkins
Darts,09-Jan 15:15,Modus Super Series,Johnny Haines v Martyn Turner
Darts,09-Jan 15:25,Modus Super Series,Robert Thornton v Kevin Painter
Darts,09-Jan 22:05,Modus Super Series,Neil Duff v Simon Whitlock
Darts,09-Jan 22:15,Modus Super Series,Trina Gulliver v Steve West
Darts,09-Jan 22:25,Modus Super Series,Simon Whitlock v Paul Hogan
Darts,09-Jan 22:35,Modus Super Series,Steve West v Neil Duff
Football,09-Jan 09:00,Israel Liga Bet,Maccabi Beer Yaakov Amit v MS Ramla
Football,09-Jan 09:30,Club Friendly,Spartak Trnava v OFK Malzenice
Football,09-Jan 10:15,Israel Liga Bet,Shikun Hamizrah v Bnei Eilat
Football,09-Jan 10:30,Club Friendly,Yverdon v KFCO Beerschot-Wilrijk
Football,09-Jan 11:30,Israel Liga Alef North,Maccabi Nujeidat v MS Tira
Football,09-Jan 11:30,Singapore Premier League,Geylang International FC v Balestier Khalsa
Football,09-Jan 12:00,Future Cup,SonderjyskE U21 v FC Midtjylland U21
Football,09-Jan 12:00,Club Friendly,SonderjyskE v FC Midtjylland
Football,09-Jan 12:30,Egypt Second Division,Dayrout v El Daklyeh
Football,09-Jan 12:55,Oman First Division League,Muscat Club v Nizwa Club
Football,09-Jan 13:00,Malaysia Super League,Negeri Sembilan v Johor Darul Takzim
Football,09-Jan 13:25,Bahrain Premier League,Al Khalidiyah v Al-Najma (BRN)
Football,09-Jan 14:00,England Premier League 2,Stoke U21 v Southampton U21
Football,09-Jan 14:00,England U21 Professional Development League,Sheffield Wednesday U21 v Barnsley U21
Football,09-Jan 14:00,Brazil Sao Paulo Youth Cup,America SP U20 v Bahia BA U20
Football,09-Jan 14:00,AFC U23 Championship,Kyrgyzstan U23 v Vietnam U23
Football,09-Jan 14:30,Iraq Stars League,Al Naft SC v Diala
Football,09-Jan 14:30,Iraq Stars League,Al Quwa Al Jawiya v Al Karma
Football,09-Jan 15:00,Algeria Ligue 1,MB Rouisset v USM Khenchela
Football,09-Jan 15:00,Ethiopia Premier League,Mekelle 70 Enderta FC v Sheger Ketema
Football,09-Jan 15:00,Algeria Ligue 1,Aso Chlef v MC Alger
Football,09-Jan 15:00,England Premier League 2,Norwich U21 v Liverpool U21
Football,09-Jan 15:00,Algeria Ligue 1,CS Constantine v JS Saoura
Football,09-Jan 15:05,Saudi Arabia Pro League,Al Taawon Buraydah (KSA) v Al Shabab Riyadh
Football,09-Jan 15:25,Qatar U19 League,Qatar SC U19 v Al Sadd U19
Football,09-Jan 15:25,Qatar U19 League,Al Mesaimeer U19 v Al Duhail SC U19
Football,09-Jan 15:25,Qatar U19 League,Al Gharafa U19 v Al Ahli SC (Doha) U19
Football,09-Jan 15:30,Club Friendly,Hertha Berlin v Standard Liege
Football,09-Jan 15:30,Ghana Premier League,Techiman Eleven Wonders FC v Basake Holy Stars
Football,09-Jan 16:00,Brazil Sao Paulo Youth Cup,America FC RN U20 v Sobradinho U20
Football,09-Jan 16:00,Brazil Sao Paulo Youth Cup,Capivariano U20 v Rio Branco AC U20
Football,09-Jan 16:00,Bahrain Premier League,Al Bahrain SC v Al Riffa
Football,09-Jan 16:00,Brazil Sao Paulo Youth Cup,America FC RN U20 v Sobradinho U20
Football,09-Jan 16:00,France National 3,US Orleans Loiret Football II v Jura Sud
Football,09-Jan 16:00,Brazil Sao Paulo Youth Cup,Sao Bento U20 v Cascavel U20
Football,09-Jan 16:00,Brazil Sao Paulo Youth Cup,Capivariano U20 v Rio Branco AC U20
Football,09-Jan 16:00,Brazil Sao Paulo Youth Cup,Botafogo SP U20 v Tuna Luso U20
Football,09-Jan 16:00,Brazil Sao Paulo Youth Cup,Volta Redonda U20 v Atletico BA U20
Football,09-Jan 16:30,AFC U23 Championship,Jordan U23 v Saudi Arabia U23
Football,09-Jan 17:00,Algeria Ligue 1,CR Belouizdad v JS Kabilye
Football,09-Jan 17:00,Turkey 1. Lig,Amed Sportif Faliyetler v Corum Belediyespor
Football,09-Jan 17:00,Israel Liga Leumit,Maccabi Petach Tikva v Hapoel Ramat Gan
Football,09-Jan 17:00,Israel Liga Leumit,Hapoel Akko v Hapoel Hadera
Football,09-Jan 17:00,Cyprus Division 1,AEL Limassol v Omonia Nicosia
Football,09-Jan 17:30,Saudi Arabia Pro League,Al-Kholood v Al Ittihad (KSA)
Football,09-Jan 18:00,France National 2,Bobigny v Rumilly Vallieres
Football,09-Jan 18:00,Spain Primera RFEF Group 2,Sevilla FC II v Villarreal B
Football,09-Jan 18:15,Brazil Sao Paulo Youth Cup,Santa Fe Futebol Clube U20 v Chapecoense AF U20
Football,09-Jan 18:15,Brazil Sao Paulo Youth Cup,AA Flamengo Guarulhos U20 v Vitoria BA U20
Football,09-Jan 18:15,Brazil Sao Paulo Youth Cup,CA Juventus Sao Paulo U20 v Retro FC U20
Football,09-Jan 18:15,Brazil Sao Paulo Youth Cup,CA Bandeirante U20 v Santa Cruz FC Recife U20
Football,09-Jan 18:15,Brazil Sao Paulo Youth Cup,Tanabi SP U20 v Goias EC U20
Football,09-Jan 19:00,England Premier League 2,Man City U21 v Burnley U21
Football,09-Jan 19:00,England Premier League 2,Ipswich U21 v Fulham U21
Football,09-Jan 19:00,England Premier League 2,Newcastle U21 v Middlesbrough U21
Football,09-Jan 19:00,Netherlands Eerste Divisie,Maastricht v Almere City
Football,09-Jan 19:00,England Premier League 2,Everton U21 v Leicester U21
Football,09-Jan 19:00,France National 2,La Roche-sur-Yon v Granville
Football,09-Jan 19:00,England Premier League 2,Arsenal U21 v West Brom U21
Football,09-Jan 19:00,Africa Cup Of Nations,Cameroon v Morocco
Football,09-Jan 19:00,England Premier League 2,Derby U21 v Sunderland U21
Football,09-Jan 19:00,England Premier League 2,Brighton U21 v Aston Villa U21
Football,09-Jan 19:00,Netherlands Eerste Divisie,Vitesse Arnhem v FC Eindhoven
Football,09-Jan 19:00,Netherlands Eerste Divisie,Willem II v ADO Den Haag
Football,09-Jan 19:00,Brazil Sao Paulo Youth Cup,Trindade AC U20 v Luverdense EC U20
Football,09-Jan 19:00,England Premier League 2,Brighton U21 v Aston Villa U21
Football,09-Jan 19:00,England Premier League 2,Everton U21 v Leicester U21
Football,09-Jan 19:00,England Premier League 2,Arsenal U21 v West Brom U21
Football,09-Jan 19:00,England Premier League 2,Derby U21 v Sunderland U21
Football,09-Jan 19:00,England Premier League 2,Man City U21 v Burnley U21
Football,09-Jan 19:00,England Premier League 2,Newcastle U21 v Middlesbrough U21
Football,09-Jan 19:30,Wales Cymru South,Newport City FC v Caerau Ely
Football,09-Jan 19:30,Belgium Second Amateur Division - VFV A,KSV Oudenaarde v RFC Wetteren
Football,09-Jan 19:30,Germany Bundesliga 1,Eintracht Frankfurt v Borussia Dortmund
Football,09-Jan 19:30,Iceland Reykjavik Cup Women,Throttur Reykjavik Women v Fjölnir Women
Football,09-Jan 19:30,England FA Cup,Port Vale v Fleetwood Town
Football,09-Jan 19:30,Club Friendly,Galway FC v Treaty United
Football,09-Jan 19:30,Italy Lega Pro Prima Divisione Girone C,Audace Cerignola v Potenza
Football,09-Jan 19:30,Iceland Reykjavik Cup Women,Fjölnir Women v Throttur Reykjavik Women
Football,09-Jan 19:30,Spain Segunda Division,Cadiz v Gijon
Football,09-Jan 19:30,Wales Cymru South,Pontypridd United v Ammanford AFC
Football,09-Jan 19:30,Wales Cymru South,Trefelin BGC v Trethomas Bluebirds
Football,09-Jan 19:30,Italy Lega Pro Prima Divisione Girone B,Ascoli v Ternana
Football,09-Jan 19:30,England FA Cup,Preston v Wigan Athletic
Football,09-Jan 19:30,England FA Cup,Wrexham v Nottingham Forest
Football,09-Jan 19:30,England FA Cup,MK Dons v Oxford United
Football,09-Jan 19:45,Wales Premier League,Caernarfon Town v Connahs Quay
Football,09-Jan 19:45,Scotland Championship,Ross County v Partick Thistle
Football,09-Jan 19:45,Wales Premier League,Haverfordwest County AFC v Briton Ferry Llansawel
Football,09-Jan 19:45,Wales Premier League,Flint Town United v Bala Town
Football,09-Jan 19:45,Wales Premier League,Pen-y-Bont FC v Cardiff Metropolitan University FC
Football,09-Jan 19:45,Wales Premier League,Barry Town v Llanelli
Football,09-Jan 19:45,England Northern Premier League Division One West,Atherton Collieries AFC v Stalybridge Celtic
Football,09-Jan 19:45,Wales Premier League,Pen-y-Bont FC v Cardiff Metropolitan University FC
Football,09-Jan 19:45,Wales Premier League,The New Saints v Colwyn Bay
Football,09-Jan 19:45,Northern Ireland Cup,Coleraine v Crusaders
Football,09-Jan 19:45,England Isthmian League Premier Division,Hashtag United v Dartford
Football,09-Jan 19:45,England Northern Premier League Division One West,Atherton Collieries AFC v Stalybridge Celtic
Football,09-Jan 19:45,England Isthmian League Premier Division,Cray Wanderers v Aveley
Football,09-Jan 19:45,Brazil Sao Paulo Youth Cup,Olimpico SE U20 v Carajas U20
Football,09-Jan 20:00,Munster Senior League,Carrigaline United v Midleton FC
Football,09-Jan 20:00,Gibraltar Premier Division,College Europa v St. Joseph's FC
Football,09-Jan 20:00,France National 3,Etoile Sportive Fosseenne v Lyon Duchere
Football,09-Jan 20:00,Spain Primera Division,Getafe v Real Sociedad
Football,09-Jan 20:15,Spain Primera RFEF Group 1,Tenerife v Talavera CF
Football,09-Jan 20:15,Brazil Sao Paulo Youth Cup,Velo Clube U20 v Guanabara City FC U20
Football,09-Jan 21:00,Brazil Sao Paulo Youth Cup,Noroeste SP U20 v Atletico PI U20
Football,09-Jan 21:15,Brazil Sao Paulo Youth Cup,XV de Jau U20 v SC Corinthians U20
Football,09-Jan 21:30,Brazil Pernambucano,Retro FC Brasil v Academica Vitoria
Football,09-Jan 21:45,Brazil Sao Paulo Youth Cup,Guarani FC SP U20 v Naviraiense U20
Football,09-Jan 21:45,Brazil Sao Paulo Youth Cup,Oeste FC U20 v Marica U20
Football,09-Jan 22:00,Trinidad and Tobago TT Premier Football League,Prisons FC v 1976 Phoenix FC
Football,09-Jan 22:00,Trinidad and Tobago TT Premier Football League,Club Sando v 1976 Phoenix FC
Football,09-Jan 22:00,Mexico Segunda Division,Atletico Hidalgo FC v Gavilanes Matamoros
Football,09-Jan 22:00,Brazil Sao Paulo Youth Cup,Gremio Prudente U20 v Ceara SC Fortaleza U20
Football,09-Jan 22:15,Brazil Sao Paulo Youth Cup,Barra SC U20 v Esporte Club de Patos U20
Football,09-Jan 22:30,Brazil Sao Paulo Youth Cup,I9 Futebol Clube U20 v CR Vasco da Gama U20
Football,09-Jan 23:00,Brazil Paulista A2,Oeste Itapolis v Associacao Ferroviaria de Esportes
Football,09-Jan 23:15,Brazil Sao Paulo Youth Cup,Comercial SP U20 v America MG U20
Football,09-Jan 23:30,Brazil Pernambucano,Nautico Capibaribe v Maguary PE
Football,10-Jan 00:00,Club Friendly,Santa Fe v Deportivo Tachira
Football,10-Jan 00:00,Trinidad and Tobago TT Premier Football League,San Juan Jabloteh v AC Port of Spain
Football,10-Jan 00:00,Trinidad and Tobago TT Premier Football League,Caledonia AIA v Eagles FC
Football,10-Jan 00:00,Brazil Sao Paulo Youth Cup,Assisense U20 v Athletic Club MG U20
Football,10-Jan 00:00,Brazil Sao Paulo Youth Cup,Assisense U20 v Athletic Club MG U20
Football,10-Jan 00:00,Club Friendly,Santa Fe v Deportivo Tachira
Football,10-Jan 00:30,Brazil Sao Paulo Youth Cup,Francana U20 v Cruzeiro U20
Football,10-Jan 01:00,Mexico Liga MX,Mazatlan FC v FC Juarez
Football,10-Jan 01:00,Mexico Liga de Ascenso,Mineros de Zacatecas v Tlaxcala FC
Football,10-Jan 01:00,Mexico Liga MX Femenil,Atletico San Luis Women v Pumas UNAM Women
Football,10-Jan 01:00,Mexico Liga de Ascenso,Venados FC v Irapuato
Football,10-Jan 02:00,Mexico Segunda Division,Cimarrones de Sonora v Ensenada FC
Football,10-Jan 03:00,Mexico Liga MX,Atlas v Puebla FC
Football,10-Jan 03:00,Mexico Liga MX,Club Tijuana v CF America
Football,10-Jan 03:00,Mexico Liga de Ascenso,Atletico La Paz v Tapatio
Football,10-Jan 03:00,Australia A-League Women,Wellington Phoenix Women v Melbourne City FC Women
Football,10-Jan 06:00,Australia A-League,Melbourne Victory v Western Sydney Wanderers
Football,10-Jan 07:00,Hong Kong Premier League,Tai Po v Kowloon City
Football,10-Jan 08:00,Australia A-League Women,Newcastle Jets Women v Central Coast Mariners Women
Football,10-Jan 08:30,Vietnam U19 National League Women,Ha Nam U19 Women v TP Ho Chi Minh U19 Women
Football,10-Jan 08:30,Indonesia Liga II,PSS Sleman v PSIS Semarang
Football,10-Jan 08:30,Indonesia Liga 1,Persebaya 1927 v Malut United
Football,10-Jan 08:35,Australia A-League,Macarthur FC v Sydney FC
Football,10-Jan 09:00,Thai League 3 - East,Royal Thai Fleet v Padriew City
Football,10-Jan 09:00,Thailand T3,Thai Army FC v Samut Sakhon City FC
Football,10-Jan 09:00,Thai League 3,Prime Bangkok v Ang Thong FC
Football,10-Jan 09:00,Thailand T3,Krabi FC v Phuket Andaman FC
Football,10-Jan 09:00,U19 Cup Israel,Beitar Jerusalem Oren U19 v Bnei Yehuda Tel Aviv U19
Football,10-Jan 09:00,Thailand T3,Assumption United F.C. v Nonthaburi United S.Boonmeerit
Football,10-Jan 09:00,U19 Cup Israel,Hapoel Jerusalem U19 v Maccabi Haifa U19
Football,10-Jan 09:00,Club Friendly,FC Brno B v SK Lisen II
Football,10-Jan 09:00,Israel Liga Bet,MS Bnei Mamba Golan and Galil v Hapoel Bnei Jdaidie Makr
Football,10-Jan 09:00,Thai League 3,Futera United FC v Pathumthani University
Football,10-Jan 09:00,U19 Cup Israel,Hapoel Kfar Saba U19 v Hapoel Petach Tikva U19
Football,10-Jan 09:00,Malaysia Super League,Imigresen v Kelantan United
Football,10-Jan 09:00,Malaysia Super League,Imigresen v Kelantan United
Football,10-Jan 09:30,Club Friendly,Kromeriz v FK Hodonin
Football,10-Jan 09:30,Czech Republic Tipsport Liga,Mlada Boleslav v FC Hradec Kralove II
Football,10-Jan 09:30,Czech Republic Tipsport Liga,Mlada Boleslav v Hradec Kralove
Football,10-Jan 09:30,Czech Republic Tipsport Liga,Dukla Prague B v FK Teplice
Football,10-Jan 09:30,Czech Republic Tipsport Liga,Prostejov v FC Zlin
Football,10-Jan 10:00,Turkey Division 3/2,Kilis Belediyespor v Kahramanmarasspor
Football,10-Jan 10:00,Turkey Division 3/2,Nigde Belediyesispor v Yeni Diyarbakirspor
Football,10-Jan 10:00,Turkey Division 3/3,1926 Bulancakspor v Fatsa Belediyespor
Football,10-Jan 10:00,Turkey Division 3/3,Amasyaspor 1968 v Giresunspor
Football,10-Jan 10:00,Italy Campionato Primavera 2,Virtus Entella U19 v Cittadella U19
Football,10-Jan 10:00,Turkey Division 3/3,Cayelispor v Pazarspor
Football,10-Jan 10:00,Italy Campionato Primavera 2,Crotone U19 v AC Spezia Calcio U19
Football,10-Jan 10:00,Club Friendly,Austria Vienna v SR Donaufeld
Football,10-Jan 10:00,Italy Campionato Primavera 2,AC Pisa 1909 U19 v Cosenza U19
Football,10-Jan 10:00,Thailand T3,Surin City FC v Yasothon FC
Football,10-Jan 10:00,Ethiopia Premier League,Defence Force SC v Bahirdar Ketema
Football,10-Jan 10:00,Club Friendly,Varazdin v NK Sesvete
Football,10-Jan 10:00,Thailand T3,Khonkaen Mordindang v Suranaree Black Cat FC
Football,10-Jan 10:00,U19 Cup Israel,Hapoel Beer Sheva Hashlosha U19 v Hakoah Ramat Gan U19
Football,10-Jan 10:00,Thailand T3,Chiang Rai City FC v Chiangmai FC
Football,10-Jan 10:00,Club Friendly,Sandecja Nowy Sacz v Wisla Krakow II
Football,10-Jan 10:00,Club Friendly,FC Slovacko v MFK Skalica
Football,10-Jan 10:00,Club Friendly,SK Sigma Olomouc v Piast Gliwice
Football,10-Jan 10:00,Club Friendly,Polonia Bytom v Banik Ostrava II
Football,10-Jan 10:00,Club Friendly,Slaven Koprivnica v Arsimi
Football,10-Jan 10:00,Turkey Division 2 Beyaz,Iskenderun FK v Beyoglu Yeni Carsi
Football,10-Jan 10:00,Turkey Division 2 Beyaz,Ankaraspor v Kastamonuspor
Football,10-Jan 10:00,Turkey Division 2 Kirmizi,Fethiyespor v Ankara Demirspor
Football,10-Jan 10:00,Turkey Division 2 Kirmizi,Kahramanmaras Istiklal Spor v Aliaga FAS
Football,10-Jan 10:00,Campionato Primavera 1,SSC Napoli U20 v Lazio U19
Football,10-Jan 10:00,Ethiopia Premier League,Defence Force SC v Bahirdar Ketema
Football,10-Jan 10:00,Turkey Division 3/2,Kilis Belediyespor v Kahramanmarasspor
Football,10-Jan 10:00,Turkey Division 2 Beyaz,Iskenderun FK v Beyoglu Yeni Carsi
Football,10-Jan 10:15,Italy Campionato Primavera 2,Avellino U19 v Empoli FC U19
Football,10-Jan 10:30,Club Friendly,FC Paradiso v Rapperswil Jona
Football,10-Jan 10:30,Club Friendly,GKS Tychy v Goczalkowice Zdroj
Football,10-Jan 10:30,Spain Tercera Division,Real Union de Tenerife v Lanzarote
Football,10-Jan 10:30,South Africa Diski Challenge,Stellenbosch U23 v Polokwane City U23
Football,10-Jan 10:30,Club Friendly,KV Mechelen v Servette
Football,10-Jan 10:30,Club Friendly,Unirea Slobozia v Otelul Galati
Football,10-Jan 10:30,Turkey 1. Lig,Serik Belediyespor v Istanbulspor Region
Football,10-Jan 10:45,Australia A-League,Perth Glory v Central Coast Mariners
Football,10-Jan 11:00,Portugal Campeonato Nacional Feminino,Vitoria Guimaraes SC Women v Sporting Braga Women
Football,10-Jan 11:00,Club Friendly,Zilina v Gornik Zabrze
Football,10-Jan 11:00,Iceland Reykjavik Cup,Fram Reykjavik v Leiknir Reykjavik
Football,10-Jan 11:00,Thai League 3 - East,Bankhai United v Pluakdaeng United
Football,10-Jan 11:00,Portugal Liga Revelacao U23,Farense U23 v Vizela U23
Football,10-Jan 11:00,Italy Campionato Primavera 2,US Citta di Palermo U19 v US Salernitana 1919 U19
Football,10-Jan 11:00,Spain Division de Honor U19 - Group 2,Ath Bilbao U19 v UD Logrones U19
Football,10-Jan 11:00,Spain Primera Division Women,Alhama Women v Eibar Women
Football,10-Jan 11:00,Club Friendly,NK Maribor v NK Kety Emmi Bistrica
Football,10-Jan 11:00,Thailand Premier League,Lamphun Warrior v BG Pathum Utd
Football,10-Jan 11:00,Greece U19 Cup,PAOK U19 v Olympiakos U19
Football,10-Jan 11:00,Portugal Liga Revelacao U23,CS Maritimo Funchal U23 v GD Estoril Praia U23
Football,10-Jan 11:00,Spain Primera Division Women,Atletico Madrid Women v Real Sociedad Women
Football,10-Jan 11:00,Spain Tercera Division,Arucas CF v CD Marino
Football,10-Jan 11:00,Campeonato de Portugal,Mirandela v Machico
Football,10-Jan 11:00,Vietnam U19 National League Women,Than KSVN U19 Women v Ha Noi FC U19 Women
Football,10-Jan 11:00,Portugal U19 League South,CD Tondela U19 v SL Benfica Lisbon U19
Football,10-Jan 11:00,Thailand T2,Pattani v Songkhla
Football,10-Jan 11:15,Greece First Division Women,AO Agia Paraskevi Women v Panathinaikos FC Women
Football,10-Jan 11:15,Greece First Division Women,AO Agia Paraskevi Women v Panathinaikos FC Women
Football,10-Jan 11:30,AFC U23 Championship,United Arab Emirates U23 v Japan U23
Football,10-Jan 11:30,France Coupe de France Women,Dijon FCO Women v Toulouse Women
Football,10-Jan 11:30,Spain Women Primera Federacion,UDG Tenerife B Women v Oviedo Women
Football,10-Jan 11:30,Singapore Premier League,Albirex v Courts Young Lions
Football,10-Jan 11:30,Thailand Premier League,Port FC v Sukhotai FC
Football,10-Jan 11:30,Thailand T2,Kasetsart University v Nongbua Pitchaya FC
Football,10-Jan 11:30,AFC U23 Championship,Lebanon U23 v Korea Republic U23
Football,10-Jan 11:30,Singapore Cup,Lion City Sailors FC v Tampines Rovers
Football,10-Jan 11:45,Brazil Sao Paulo Youth Cup,Real Brasilia U20 v Cacoalense U20
Football,10-Jan 11:45,Brazil Sao Paulo Youth Cup,Portuguesa Santista U20 v CSE U20
Football,10-Jan 12:00,Turkey Division 3/1,Yesil Yalova FK v Beykoz Ishaklispor
Football,10-Jan 12:00,Turkey Division 3/3,Karabuk Idman Yurdu v Yeni Orduspor
Football,10-Jan 12:00,England Premier League 2,Reading U21 v Leeds U21
Football,10-Jan 12:00,Campeonato de Portugal,Lusitania v Samora Correia
Football,10-Jan 12:00,Club Friendly,FC Nordsjaelland v Fredericia
Football,10-Jan 12:00,Albania Cup,KF Tirana v Skenderbeu
Football,10-Jan 12:00,Czech Republic Tipsport Liga,Slovan Liberec II v MFK Chrudim
Football,10-Jan 12:00,Ethiopia Premier League,CBE SA v Hadia Hosaina
Football,10-Jan 12:00,Club Friendly Women,Slavia Prague Women v BTS Rekord Bielsko-Biela Women
Football,10-Jan 12:00,U19 Cup Israel,Hapoel Qiryat Shemona U19 v FC Ashdod U19
Football,10-Jan 12:00,Turkey Division 2 Kirmizi,Güzide Gebzespor v Somaspor
Football,10-Jan 12:00,Kenya Super League,Kisumu Allstars v Fortune Sacco
Football,10-Jan 12:00,Campionato Primavera 1,Torino FC U20 v AC Milan U20
Football,10-Jan 12:00,Segunda RFEF - Group 2 Women,FC Levante Badalona II Women v CD Samper Women
Football,10-Jan 12:00,Albania Cup,Partizani Tirana v Burreli
Football,10-Jan 12:00,Albania Cup,Dinamo Tirana v Besa Kavaje
Football,10-Jan 12:00,Kenya Premier League,Bandari FC (Kenya) v Kakamega Homeboyz
Football,10-Jan 12:00,Club Friendly Women,KIF Orebro Women v Djurgardens IF Women
Football,10-Jan 12:00,Iraq Stars League,Al Karkh v Al Najaf
Football,10-Jan 12:00,Club Friendly,Kromeriz v Povazska Bystrica
Football,10-Jan 12:00,Thailand T2,Khonkaen United v Chainat
Football,10-Jan 12:00,Campionato Primavera 1,Torino FC U20 v AC Milan U20
Football,10-Jan 12:00,Kenya Premier League,Mathare United v Muranga Seal FC
Football,10-Jan 12:00,Thailand Premier League,Bangkok United v Kanchanaburi
