,Sport,Date,Competition,Description
1304,Football,21-Dec 13:30,Italy Serie D - Group E,ASD Tau Calcio Altopascio v US Gavorrano
1305,Football,21-Dec 13:30,Italy Serie D - Group E,ASD Tau Calcio Altopascio v US Gavorrano
1306,Football,21-Dec 13:30,Netherlands Eredivisie,Go Ahead Eagles v Groningen
1307,Football,21-Dec 13:30,Scotland Premiership,Hearts v Rangers
1308,Football,21-Dec 13:30,Italy Lega Pro Prima Divisione Girone A,Pro Vercelli v ASD Union ArziganoChampo
1309,Football,21-Dec 13:30,Italy Lega Pro Prima Divisione Girone A,Vicenza v Triestina
1310,Football,21-Dec 13:30,Italy Lega Pro Prima Divisione Girone B,Pianese v Ternana
1311,Football,21-Dec 13:30,Italy Lega Pro Prima Divisione Girone B,Ravenna FC 1913 v Rimini
1312,Football,21-Dec 13:30,Italy Lega Pro Prima Divisione Girone C,Latina v Crotone
1313,Football,21-Dec 13:30,Azerbaijan Premier League,FK Araz v Shamakhi FK
1314,Football,21-Dec 13:45,France Cup,Nice v St Etienne
1315,Football,21-Dec 13:45,France Cup,Bourg-en-Bresse v Marseille
1316,Football,21-Dec 13:45,France Cup,Auxerre v AS Monaco
1317,Football,21-Dec 13:45,France Cup,Strasbourg v USL Dunkerque
1318,Football,21-Dec 13:45,France Cup,Concarneau v Nantes
1319,Football,21-Dec 14:00,Italy Serie A,Como v AC Milan
1320,Football,21-Dec 14:00,Turkey Division 2 Beyaz,Beykoz Anadolu v Karaman FK
1321,Football,21-Dec 14:00,Italy Serie A,Hellas Verona FC v Bologna
1322,Football,21-Dec 14:00,Turkey Division 2 Beyaz,Erzincan Refahiyespor v Elazigspor
1323,Football,21-Dec 14:00,Italy Serie A,FC Internazionale v Lecce
1324,Football,21-Dec 14:00,Turkey Division 2 Beyaz,Muglaspor v Kastamonuspor
1325,Football,21-Dec 14:00,Turkey Division 2 Beyaz,Ankaraspor v Sanliurfaspor
1326,Football,21-Dec 14:00,Turkey Division 2 Beyaz,Inegolspor v Altinordu
1327,Football,21-Dec 14:00,Turkey Division 2 Beyaz,Bucaspor v Karacabey Belediyespor
1328,Football,21-Dec 14:00,Turkey Division 2 Beyaz,Iskenderun FK v Ankaragucu
1329,Football,21-Dec 14:00,Turkey Division 2 Beyaz,Erbaaspor v Beyoglu Yeni Carsi
1330,Football,21-Dec 14:00,Campionato Primavera 1,SSC Napoli U20 v AC Milan U20
1331,Football,21-Dec 14:00,Turkey Division 2 Beyaz,Kepez Belediyespor v Batman Petrolspor
1332,Football,21-Dec 14:00,San Marino Campionato Sammarinese,Cosmos v SP La Fiorita
1333,Football,21-Dec 14:00,Campionato Primavera 1,Bologna U20 v Cremonese U20
1334,Football,21-Dec 14:00,Italy Serie D - Group H,Martina v ASD SS Nola 1925
1335,Football,21-Dec 14:00,Scotland Women's Premier League 2,St Johnstone WFC Women v Boroughmuir Thistle FC Women
1336,Football,21-Dec 14:00,Scotland Women's Premier League 2,St Johnstone WFC Women v Boroughmuir Thistle FC Women
1337,Football,21-Dec 14:00,Lebanon Premier League,Al Safa Beirut v Jwaya SC
1338,Football,21-Dec 14:00,Italy Serie D - Group A,SSD NovaRomentin v SC Ligorna
1339,Football,21-Dec 14:00,England Women's Championship,Charlton Athletic WFC v Nottingham Forest Women
1340,Football,21-Dec 14:00,Scotland Women's Premier League 2,Stirling University LFC Women v Dundee Utd Women
1341,Football,21-Dec 14:00,England Women's Championship,Birmingham City W.F.C v Durham Women
1342,Football,21-Dec 14:00,Nigeria Premier League,El Kanemi Wanderers v Enyimba
1343,Football,21-Dec 14:00,Italy Serie D - Group I,ASD Sambiase 2023 v La Fenice Amaranto ASD
1344,Football,21-Dec 14:00,Spain Tercera RFEF Women,El Gancho CF Women v Valdefierro CD Women
1345,Football,21-Dec 14:00,Italy Serie D - Group F,Vigor Senigallia v Unipomezia 1938
1346,Football,21-Dec 14:00,England FA Women's National League - Division One South East,Cambridge United FC Women v Fulham LFC
1347,Football,21-Dec 14:00,Italy Serie D - Group H,Paganese v USD Citta di Fasano
1348,Football,21-Dec 14:00,Italy Serie D - Group I,Gela Calcio v ASD Gelbison Vallo della Lucania
1349,Football,21-Dec 14:00,Italy Serie A,Sassuolo v Torino
1350,Football,21-Dec 14:00,Croatia 1. HNL,Hajduk Split v NK Vukovar '91
1351,Football,21-Dec 14:00,Serbia Super Liga,FK Spartak Subotica v Cukaricki
1352,Football,21-Dec 14:00,England National League,Braintree Town v Hartlepool United
1353,Football,21-Dec 14:00,Hungary NB I,Ujpest v Kazincbarcika
1354,Football,21-Dec 14:00,Portugal Division 2,Leixoes v CS Maritimo
1355,Football,21-Dec 14:00,England National League,Gateshead v Eastleigh
1356,Football,21-Dec 14:00,Italy Serie B,Virtus Entella v Sudtirol
1357,Football,21-Dec 14:00,Bosnia and Herzegovina Premier League,Borac Banja Luka v Zrinjski Mostar
1358,Football,21-Dec 14:00,Italy Serie A,Napoli v Parma FC
1359,Football,21-Dec 14:00,Turkey Division 3/4,Afjet Afyonspor v Altay
1360,Football,21-Dec 14:00,England Premier League Cup,Stoke U21 v Derby U21
1361,Football,21-Dec 14:00,Turkey Division 3/4,Balikesirspor v FK Bornova
1362,Football,21-Dec 14:00,Lebanon Premier League,Al Safa Beirut v Jwayya SC
1363,Football,21-Dec 14:15,Italy Serie D - Group G,Valmontone 1921 v ASD Real Monterotondo Scalo
1364,Football,21-Dec 14:25,Kuwait Division 1,Al Shamiya v Al Sulaibikhat
1365,Football,21-Dec 14:30,Nigeria Premier League,Kano Pillars FC v Plateau United FC
1366,Football,21-Dec 14:30,Qatar 2nd Division,Al Kharitiyath v Muaither SC
1367,Football,21-Dec 14:30,Qatar 2nd Division,Al Kharitiyath v Muaither SC
1368,Football,21-Dec 14:30,Germany Bundesliga 1,Mainz 05 v St Pauli
1369,Football,21-Dec 14:30,Spain Division de Honor U19 - Group 6,UD Las Palmas U19 v CD Mensajero U19
1370,Football,21-Dec 14:30,Spain Segunda B1,Rayo Cantabria v Coruxo
1371,Football,21-Dec 14:30,Qatar 2nd Division,Lusail Club v Al Markhiya
1372,Football,21-Dec 14:30,Spain Tercera Division,CD Zuera v Andorra CF
1373,Football,21-Dec 14:30,Qatar 2nd Division,Al Wa'ab SC v Al-Mesaimeer
1374,Football,21-Dec 14:30,Romania Liga I,Universitatea Cluj v Farul Constanta
1375,Football,21-Dec 14:45,Spain Tercera Division,Tuilla v Club Siero
1376,Football,21-Dec 14:50,Saudi Arabia Pro League,Al Feiha (KSA) v Neom SC
1377,Football,21-Dec 15:00,Campeonato de Portugal,Vila Real v Leca FC
1378,Football,21-Dec 15:00,Nigeria Premier League,Kwara United v Bayelsa United
1379,Football,21-Dec 15:00,Spain Tercera RFEF Women,Madrid CFF III Women v CF Pozuelo de Alarcon II Women
1380,Football,21-Dec 15:00,Spain Tercera RFEF Women,CD Badajoz Women v Extremadura FCF Women
1381,Football,21-Dec 15:00,Spain Tercera Division,CD Illueca v AD Almudevar
1382,Football,21-Dec 15:00,Spain Tercera Division,CD Pradejon v Pena Balsamaiso CF
1383,Football,21-Dec 15:00,Belgium Pro League,Sint Truiden v KV Mechelen
1384,Football,21-Dec 15:00,Spain Primera RFEF Group 1,Barakaldo CF v Pontevedra
1385,Football,21-Dec 15:00,Spain Primera RFEF Group 1,CD Guadalajara v Zamora CF
1386,Football,21-Dec 15:00,Belgium Division 1 B,Daring Brussels v Royal FC de Liege
1387,Football,21-Dec 15:00,Spain Primera RFEF Group 2,Sevilla FC II v Atletico Sanluqueno CF
1388,Football,21-Dec 15:00,Belgium Division 1 B,Lokeren-Temse v Patro Eisden Maasmechelen
1389,Football,21-Dec 15:00,Portugal Liga 3,Vitoria Guimaraes SC II v Paredes
1390,Football,21-Dec 15:00,Germany Women's Division 1,RB Leipzig Women v FC Koln Women
1391,Football,21-Dec 15:00,Portugal Liga 3,Amarante v Fafe
1392,Football,21-Dec 15:00,Portugal Liga 3,Marco 09 v Sao Joao Ver
1393,Football,21-Dec 15:00,Portugal Liga 3,Covilha v CF Os Belenenses
1394,Football,21-Dec 15:00,Portugal Liga 3,Academica v Lusitano de Evora
1395,Football,21-Dec 15:00,Campeonato de Portugal,Aparecida v Cinfaes
1396,Football,21-Dec 15:00,Campeonato de Portugal,GD Resende (Por) v FC Alpendorada
1397,Football,21-Dec 15:00,Campeonato de Portugal,Anadia v Vila Mea
1398,Football,21-Dec 15:00,Campeonato de Portugal,Rebordosa v Florgrade
1399,Football,21-Dec 15:00,Campeonato de Portugal,Uniao da Serra v Samora Correia
1400,Football,21-Dec 15:00,Campeonato de Portugal,Portimonense II v Sintrense
1401,Football,21-Dec 15:00,Campeonato de Portugal,Salgueiros v Uniao Lamas
1402,Football,21-Dec 15:00,Portugal U19 League North,FC Pacos de Ferreira U19 v Gil Vicente FC U19
1403,Football,21-Dec 15:00,Campeonato de Portugal,Electrico v Mortagua
1404,Football,21-Dec 15:00,Campeonato de Portugal,Aparecida v Cinfaes
1405,Football,21-Dec 15:00,Campeonato de Portugal,AD Limianos v Vianense
1406,Football,21-Dec 15:00,Campeonato de Portugal,Lusitano Moncarapachense v Elvas
1407,Football,21-Dec 15:00,Campeonato de Portugal,Vilaverdense v Braganca
1408,Football,21-Dec 15:00,Campeonato de Portugal,Marinhense v FC Oliveira do Hospital
1409,Football,21-Dec 15:00,Campeonato de Portugal,Beira-Mar v Gouvela
1410,Football,21-Dec 15:00,Campeonato de Portugal,Anadia v Vila Mea
1411,Football,21-Dec 15:00,Campeonato de Portugal,Benfica e Castelo Branco v Fatima
1412,Football,21-Dec 15:00,Campeonato de Portugal,Ribeira Brava v Machico
1413,Football,21-Dec 15:00,Campeonato de Portugal,GD Resende (Por) v FC Alpendorada
1414,Football,21-Dec 15:00,Campeonato de Portugal,Comercio Industria v Alverca II
1415,Football,21-Dec 15:00,Ghana Premier League,Hohoe Utd v Bibiani Gold Stars
1416,Football,21-Dec 15:00,Ghana Premier League,Nations FC v Young Apostles FC
1417,Football,21-Dec 15:00,Portugal U19 League South,CD Tondela U19 v Torreense U19
1418,Football,21-Dec 15:00,Portugal U19 League South,Mafra U19 v Academico Viseu U19
1419,Football,21-Dec 15:00,Andorra Primera Divisio,FC Santa Coloma v FC Rangers
1420,Football,21-Dec 15:00,Malta Premier League,Hamrun Spartans v Birkirkara
1421,Football,21-Dec 15:00,Portugal Liga 3,Marco 09 v Sao Joao Ver
1422,Football,21-Dec 15:00,Portugal Liga 3,Covilha v CF Os Belenenses
1423,Football,21-Dec 15:00,Spain Tercera RFEF Women,CD Badajoz Women v Extremadura FCF Women
1424,Football,21-Dec 15:00,Spain Primera RFEF Group 2,Sevilla FC II v Atletico Sanluqueno CF
1425,Football,21-Dec 15:00,Spain Tercera Division,CD Pradejon v Pena Balsamaiso CF
1426,Football,21-Dec 15:00,Portugal U19 League North,Braga U19 v Moreirense U19
1427,Football,21-Dec 15:00,Ghana Premier League,Karela v Vision FC
1428,Football,21-Dec 15:00,Ghana Premier League,Dreams FC v Berekum Chelsea
1429,Football,21-Dec 15:00,Nigeria Premier League,Abia Warriors v Warri Wolves
1430,Football,21-Dec 15:00,Nigeria Premier League,Kwara United v Bayelsa United
1431,Football,21-Dec 15:00,Nigeria Premier League,Enugo Rangers v Ikorodu City
1432,Football,21-Dec 15:00,Spain Primera RFEF Group 1,Barakaldo CF v Pontevedra
1433,Football,21-Dec 15:00,Nigeria Premier League,Remo Stars v Bendel Insurance FC
1434,Football,21-Dec 15:00,Portugal Liga 3,Academica v Lusitano de Evora
1435,Football,21-Dec 15:00,Nigeria Premier League,Shooting Stars SC v Niger Tornadoes
1436,Football,21-Dec 15:00,Nigeria Premier League,Wikki Tourists v Kun Khalifa
1437,Football,21-Dec 15:00,Spain Tercera Division,La Almunia v CD Belchite 97
1438,Football,21-Dec 15:00,Spain Tercera Division,Deportivo Maritimo v Club Atletico Pulpileno
1439,Football,21-Dec 15:00,Spain Tercera Division,CD Aoiz v FC Bidezarra
1440,Football,21-Dec 15:15,Spain Primera Division,Villarreal CF v Barcelona
1441,Football,21-Dec 15:15,Spain Segunda Division,Mirandes v Cordoba
1442,Football,21-Dec 15:15,Spain Primera RFEF Group 1,CD Lugo v Ourense CF
1443,Football,21-Dec 15:15,Spain Segunda Division,Real Sociedad II v Ceuta
1444,Football,21-Dec 15:25,Saudi Arabia Division 1,Jeddah Club (KSA) v Abha (KSA)
1445,Football,21-Dec 15:30,Pais Vasco Play Offs,Amurrio CF v Iru-Bat Santa Lucia
1446,Football,21-Dec 15:30,Greece Super League,Larissa v Atromitos
1447,Football,21-Dec 15:30,Switzerland Super League,Grasshoppers Zurich v St Gallen
1448,Football,21-Dec 15:30,Malta Challenge League,Marsa FC v St Andrews
1449,Football,21-Dec 15:30,Switzerland Super League,Lugano v Young Boys
1450,Football,21-Dec 15:30,Spain Tercera Division,Celtiga v CF Noia
1451,Football,21-Dec 15:30,Germany Bundesliga 3,Hoffenheim II v Wehen Wiesbaden
1452,Football,21-Dec 15:30,Spain Tercera Division,Muleno CF v Bala Azul
1453,Football,21-Dec 15:30,Portugal Primeira Liga,AVS SAD v Nacional da Madeira
1454,Football,21-Dec 15:30,Spain Tercera Division,Azuqueca v CD Marchamalo
1455,Football,21-Dec 15:30,Portugal Division 2,Farense v Uniao Leiria
1456,Football,21-Dec 15:30,Spain Tercera Division,San Sebastián Reyes B v Siello
1457,Football,21-Dec 15:30,United Arab Emirates Premier,Al Jazira SCC v Al Dhafra
1458,Football,21-Dec 15:30,Gibraltar Premier Division,Lincoln Red Imps FC v Lynx FC
1459,Football,21-Dec 15:30,Ghana Premier League,Aduana Stars v Hearts of Oak
1460,Football,21-Dec 15:30,Ghana Premier League,Aduana Stars v Hearts of Oak
1461,Football,21-Dec 15:30,Spain Autonomicas Castilla La Mancha Group 1,Motilla CF v Manzanares
1462,Football,21-Dec 15:30,Castilla y Leon Playoffs,CD Benavente v Zamora CF II
1463,Football,21-Dec 15:30,Malta Challenge League,Melita v Birzebbuga
1464,Football,21-Dec 15:45,Netherlands Eredivisie,Fortuna Sittard v AZ Alkmaar
1465,Football,21-Dec 15:45,Spain Tercera Division,CD Boiro v Arosa FC
1466,Football,21-Dec 15:45,Dutch Women's Eredivisie,PSV/FC Eindhoven Women v Feyenoord Women
1467,Football,21-Dec 15:45,Netherlands Eredivisie,Volendam v Sparta Rotterdam
1468,Football,21-Dec 15:45,Dutch Women's Eredivisie,Ajax Women v NAC Breda Women
1469,Football,21-Dec 15:45,Dutch Women's Eredivisie,SC Heerenveen Women v Utrecht Women
1470,Football,21-Dec 15:45,Dutch Women's Eredivisie,Excelsior Women v ADO Den Haag Women
1471,Football,21-Dec 15:45,Dutch Women's Eredivisie,AZ Alkmaar Women v PEC Zwolle Women
1472,Football,21-Dec 16:00,Valenciana Play Offs,Patacona CF v CF Atletic Quart de les Valls
1473,Football,21-Dec 16:00,Spain Segunda B3,Alcoyano v Girona B
1474,Football,21-Dec 16:00,Spain Division de Honor U19 - Group 4,UCD La Canada Atletico U19 v Calavera CF U19
1475,Football,21-Dec 16:00,Spain Tercera RFEF Women,CFF Olympia Las Rozas II Women v CD Getafe II Women
1476,Football,21-Dec 16:00,Spain Tercera RFEF Women,AF Next Level Women v Prainsa Zaragoza Women II
1477,Football,21-Dec 16:00,Spain Tercera Division,Tropezon v CD Montanas del Pas
1478,Football,21-Dec 16:00,Spain Division de Honor U19 - Group 3,RCD Espanyol U19 v UD Cornella U19
1479,Football,21-Dec 16:00,Spain Tercera Division,CD Barco v Montaneros CF
1480,Football,21-Dec 16:00,Mali Premiere Division,US Bougouba v Stade Malien
1481,Football,21-Dec 16:00,Spain Tercera Division,Haro Deportivo v CDFC La Calzada
1482,Football,21-Dec 16:00,Mauritania Premier League,Chemal FC v ASC Police
1483,Football,21-Dec 16:00,Spain Tercera Division,Racing Ciudad de Madrid v Atletico Madrid C
1484,Football,21-Dec 16:00,Spain Segunda B1,Ourense v SD Sarriana
1485,Football,21-Dec 16:00,Kuwait Division 1,Khaitan v Al Sahel
1486,Football,21-Dec 16:00,Spain Segunda B2,SD Logrones v UD Logrones
1487,Football,21-Dec 16:00,Serbia Super Liga,Radnik Surdulica v Novi Pazar
1488,Football,21-Dec 16:00,England National League,Boreham Wood v Carlisle
1489,Football,21-Dec 16:00,Spain Segunda B3,UE Sant Andreu v Cd Castellon B
1490,Football,21-Dec 16:00,Turkey 1. Lig,Istanbulspor Region v Belediye Vanspor
1491,Football,21-Dec 16:00,Turkey 1. Lig,Istanbulspor Region v Belediye Vanspor
1492,Football,21-Dec 16:00,Spain Segunda B2,Alfaro v CD Ebro
1493,Football,21-Dec 16:00,England National League,Halifax Town v Wealdstone
1494,Football,21-Dec 16:00,Spain Division de Honor U19 - Group 3,CD SAN FRANCISCO U19 v Gimnastic de Tarragona U19
1495,Football,21-Dec 16:00,Bahrain Premier League,Al-Najma (BRN) v Malkiya Club (BRN)
1496,Football,21-Dec 16:00,Spain Tercera Division,SRD Vimenor CF v UM Escobedo
1497,Football,21-Dec 16:00,Spain Tercera Division,CS Puertollano CF v Toledo
1498,Football,21-Dec 16:00,Spain Tercera Division,CD Marbelli v CD Huetor Vega
1499,Football,21-Dec 16:00,Spain Tercera Division,SD Oyonesa v CD Autol
1500,Football,21-Dec 16:10,Scotland Women's Premier League,Hearts Women v Glasgow City LFC Women
1501,Football,21-Dec 16:15,Italy Serie B,Mantova FC v Empoli
1502,Football,21-Dec 16:30,Rwanda Premier League,Al Merreikh v Gicumbi
1503,Football,21-Dec 16:30,England Premier League,Aston Villa v Manchester United
1504,Football,21-Dec 16:30,France Cup,Rennes v Les Sables FCOC
1505,Football,21-Dec 16:30,Spain Tercera Division,CD Mosconia v Praviano
1506,Football,21-Dec 16:30,Senegal Ligue 1,Ajel de Rufisque v AS Dakar Sacre Coeur
1507,Football,21-Dec 16:30,France Cup,Montreuil FC v Chauvigny
1508,Football,21-Dec 16:30,Hungary NB I,Debreceni VSC v Kisvarda FC
1509,Football,21-Dec 16:30,Italy Lega Pro Prima Divisione Girone A,Giana Erminio v Cittadella
1510,Football,21-Dec 16:30,Germany Bundesliga 1,FC Heidenheim v Bayern Munich
1511,Football,21-Dec 16:30,France Cup,Rennes v Les Sables VF
1512,Football,21-Dec 16:30,Spain Segunda B5,Real Madrid C v CDA Navalcarnero
1513,Football,21-Dec 16:30,France Cup,Le Puy v Bordeaux
1514,Football,21-Dec 16:30,Italy Lega Pro Prima Divisione Girone A,Lecco v US Pergolettese 1932
1515,Football,21-Dec 16:30,Italy Lega Pro Prima Divisione Girone A,Novara v AC Ospitaletto
1516,Football,21-Dec 16:30,Italy Lega Pro Prima Divisione Girone C,Monopoli v Potenza
1517,Football,21-Dec 16:30,France Cup,Le Havre v Amiens
1518,Football,21-Dec 16:30,France Cup,Arcachon v Hauts Lyonnais
1519,Football,21-Dec 16:30,Saudi Arabia Division 1,Al-Diriyah v Al-Zulfi
1520,Football,21-Dec 16:30,France Cup,US Orleans Loiret Football v Dieppe
1521,Football,21-Dec 16:30,Italy Lega Pro Prima Divisione Girone B,Perugia v Forli
1522,Football,21-Dec 16:30,Spain Segunda B5,Real Madrid C v CDA Navalcarnero
1523,Football,21-Dec 16:30,France Cup,Rennes v Les Sables FCOC
1524,Football,21-Dec 16:45,Croatia 1. HNL,HNK Rijeka v HNK Gorica
1525,Football,21-Dec 17:00,Spain Division de Honor U19 - Group 4,UD Tomares U19 v UD Maracena U19
1526,Football,21-Dec 17:00,Italy Serie A,Fiorentina v Udinese
1527,Football,21-Dec 17:00,Turkey Super Lig,Galatasaray v Kasimpasa SK
1528,Football,21-Dec 17:00,Spain Tercera Division,Atletico de Porcuna CF v CD El Palo
1529,Football,21-Dec 17:00,Turkey Super Lig,Goztepe v Samsunspor
1530,Football,21-Dec 17:00,Spain Tercera Division,CF Badalona v CE Manresa
1531,Football,21-Dec 17:00,Cyprus Division 1,Digenis Akritas Ypsona v Apollon Limassol
1532,Football,21-Dec 17:00,Spain Tercera Division,Caudal Deportivo v SD Navarro CF
1533,Football,21-Dec 17:00,Spain Division de Honor U19 - Group 2,SD Leioa U19 v CD Aurrera de Vitoria U19
1534,Football,21-Dec 17:00,,Giugliano v Casertana
1535,Football,21-Dec 17:00,Cyprus Division 1,AE Paphos v APOEL Nicosia
1536,Football,21-Dec 17:00,Spain Segunda B1,CD Burgos Promesas 2000 v Marino Luanco
1537,Football,21-Dec 17:15,Spain Primera RFEF Group 1,Real Aviles v Racing Club Ferrol
1538,Football,21-Dec 17:15,Spain Primera RFEF Group 2,FC Cartagena v Juventud Torremolinos CF
1539,Football,21-Dec 17:30,Spain Tercera RFEF Women,CD Monte Women v CD Roblon Women
1540,Football,21-Dec 17:30,Greece Super League,PAOK v Panathinaikos
1541,Football,21-Dec 17:30,Belgium Pro League,Royal Antwerp v Anderlecht
1542,Football,21-Dec 17:30,Spain Segunda Division,Granada CF v Albacete
1543,Football,21-Dec 17:30,Spain Primera Division,Elche CF v Rayo Vallecano
1544,Football,21-Dec 17:30,Portugal Campeonato Nacional Feminino,Sporting CP Women v SL Benfica Women
1545,Football,21-Dec 17:30,Germany Women's Division 1,VfL Wolfsburg Women v Hamburg Women
1546,Football,21-Dec 17:30,Saudi Arabia Pro League,Al-Khaleej (KSA) v Al-Kholood
1547,Football,21-Dec 17:30,Israel Liga Alef North,MS Tira v Hapoel Ironi Arraba
1548,Football,21-Dec 17:30,Spain Segunda Division,CD Burgos v Real Zaragoza
1549,Football,21-Dec 17:30,Saudi Arabia Pro League,Al-Najma (KSA) v Al Nasr (KSA)
1550,Football,21-Dec 17:45,Castilla y Leon Playoffs,CDF Helmantico v CF Salamanca UDS
1551,Football,21-Dec 18:00,Copa de la Reina (Women),Alaves Women v FC Barcelona Women
1552,Football,21-Dec 18:00,Egypt League Cup,Smouha Sporting Club v Ismaily
1553,Football,21-Dec 18:00,Egypt League Cup,Smouha Sporting Club v Ismaily
1554,Football,21-Dec 18:00,Romania Liga I,FCSB v FC Rapid Bucuresti
1555,Football,21-Dec 18:00,Copa de la Reina (Women),Alhama Women v Atletico Madrid Women
1556,Football,21-Dec 18:00,Portugal Division 2,Penafiel v Torreense
1557,Football,21-Dec 18:00,Israel Liga Bet,Beitar Nahariya v Hapoel Bnei Jdaidie Makr
1558,Football,21-Dec 18:00,Portugal Primeira Liga,Tondela v Casa Pia
1559,Football,21-Dec 18:15,Belgium Pro League,Oud-Heverlee Leuven v Cercle Brugge
1560,Football,21-Dec 18:15,Israel Premier League,Maccabi Netanya v Maccabi Tel Aviv
1561,Football,21-Dec 18:15,Belgium Division 1 B,Eupen v Charleroi-Marchienne
1562,Football,21-Dec 18:30,Gibraltar Premier Division,Europa Point v College Europa
1563,Football,21-Dec 18:30,Germany Bundesliga 3,Viktoria Koln v Duisburg
1564,Football,21-Dec 19:00,Africa Cup Of Nations,Morocco v Comoros
1565,Football,21-Dec 19:00,Spain Segunda B4,MCF Atletico Malagueno v Yeclano Deportivo
1566,Football,21-Dec 19:00,Spain Tercera Division,UE Cornella v CE Europa B
1567,Football,21-Dec 19:00,Greece Super League,AEK Athens v OFI Crete
1568,Football,21-Dec 19:00,Club Friendly,Campinense PB v ABC RN
1569,Football,21-Dec 19:30,Italy Lega Pro Prima Divisione Girone C,Virtus Casarano v ASD Altamura
1570,Football,21-Dec 19:30,Spain Primera RFEF Group 2,Real Murcia v CE Europa
1571,Football,21-Dec 19:30,Italy Lega Pro Prima Divisione Girone C,Siracusa v Trapani
1572,Football,21-Dec 19:45,Italy Serie A,Genoa v Atalanta BC
1573,Football,21-Dec 20:00,France Cup,FC Saint-Cyr Collonges au Mont d'Or v Lyon
1574,Football,21-Dec 20:00,Argentina Torneo Federal,CA Baradero v Centro Vecinal Unidos de Olmos
1575,Football,21-Dec 20:00,Argentina Torneo Federal,Los Cachorros Salta v CAS Boroquimica
1576,Football,21-Dec 20:00,Spain Primera Division,Real Betis v Getafe
1577,Football,21-Dec 20:00,Jamaica Premier League,Montego Bay United v Waterhouse FC
1578,Football,21-Dec 20:00,Spain Segunda Division,Cadiz v Castellon
1579,Football,21-Dec 20:00,Jamaica Premier League,Treasure Beach v Portmore United FC
1580,Football,21-Dec 20:00,Jamaica Premier League,Chapelton v Cavalier
1581,Football,21-Dec 20:00,Jamaica Premier League,Dunbeholden FC v Tivoli Gardens FC
1582,Football,21-Dec 20:00,France Cup,Lyon v FC Saint-Cyr Collonges au Mont d'Or
1583,Football,21-Dec 20:00,Jamaica Premier League,Mount Pleasant FC v Spanish Town Police
1584,Football,21-Dec 20:00,Jamaica Premier League,Mount Pleasant FC v Spanish Town Police
1585,Football,21-Dec 20:00,Argentina Primera B Metropolitana,CD Armenio v Acassuso
1586,Football,21-Dec 20:00,Jamaica Premier League,Racing Utd v Harbour View
1587,Football,21-Dec 20:30,International Friendly,Peru v Bolivia
1588,Football,21-Dec 20:30,Portugal Primeira Liga,Santa Clara v Arouca
1589,Football,21-Dec 21:00,Honduras Liga Nacional,Platense FC v CD Marathon
1590,Football,21-Dec 21:00,Brazil Cup,Vasco da Gama v Corinthians
1591,Football,21-Dec 21:00,Trinidad and Tobago TT Premier Football League,1976 Phoenix FC v Eagles FC
1592,Football,21-Dec 21:30,Ecuador Primera A,Independiente (Ecu) v Barcelona (Ecu)
1593,Football,21-Dec 21:30,Ecuador Primera A,LDU Quito v Universidad Catolica Quito
1594,Football,21-Dec 21:30,Ecuador Primera A,Orense Sporting Club v Libertad (Ecu)
1595,Football,21-Dec 22:30,Jamaica Premier League,Molynes v Arnett Gardens FC
1596,Football,21-Dec 23:00,Nicaragua Liga Primera Juvenil U19,Diriangen FC U19 v Real Esteli FC U19
1597,Football,21-Dec 23:00,Trinidad and Tobago TT Premier Football League,Caledonia AIA v Point Fortin FC
1598,Football,21-Dec 23:15,Argentina Torneo Federal,Club Colon Chivilcoy v CA Argentino de Chacabuco
1599,Football,22-Dec 01:00,Guatemala Liga Nacional,Antigua GFC v Dep. Municipal
1600,Football,22-Dec 07:15,Australia A-League Women,Melbourne City FC Women v Western Sydney Wanderers Women
1601,Football,22-Dec 08:30,Indonesia Liga 1,PSBS Biak Numfor v Bali United Pasum
1602,Football,22-Dec 10:00,Campionato Primavera 1,Torino FC U20 v Lecce U20
1603,Football,22-Dec 10:00,Turkey Division 2 Kirmizi,Menemen Belediyespor v 1461 Trabzon FK
1604,Football,22-Dec 10:00,Turkey Division 2 Kirmizi,Adanaspor v 1984 Musspor
1605,Football,22-Dec 10:45,HKPL U22 League,Lee Man FC U22 v North District FC U22
1606,Football,22-Dec 11:00,Portugal Liga Revelacao U23,Estrela Amadora U23 v Torreense U23
1607,Football,22-Dec 11:00,Turkey U19 PAF Ligi,Galatasaray U19 v Kasimpasa U19
1608,Football,22-Dec 11:00,Portugal Liga Revelacao U23,Portimonense SC U23 v Farense U23
1609,Football,22-Dec 11:00,Portugal Liga Revelacao U23,UD Leiria U23 v Sporting Clube de Portugal U23
1610,Football,22-Dec 11:00,Kenya Premier League,Mara Sugar v Muranga Seal FC
1611,Football,22-Dec 11:00,Portugal Liga Revelacao U23,SL Benfica Lisbon U23 v GD Estoril Praia U23
1612,Football,22-Dec 11:00,Turkey U19 PAF Ligi,Genclerbirligi U19 v Trabzonspor U19
1613,Football,22-Dec 11:00,Turkey U19 PAF Ligi,Basaksehir U19 v Gazisehir Gaziantep U19
1614,Football,22-Dec 11:00,Turkey Division 2 Kirmizi,Kirklarelispor v Icel Idmanyurdu
1615,Football,22-Dec 11:00,Turkey Division 2 Kirmizi,Kirklarelispor v Icel Idmanyurdu
1616,Football,22-Dec 12:00,Campionato Primavera 1,Cesena FC U20 v Monza U20
1617,Football,22-Dec 12:00,Greece Super League 2,Asteras Tripolis B v Anagennisi Karditsa
1618,Football,22-Dec 12:00,Turkey Division 2 Beyaz,Elazigspor v Iskenderun FK
1619,Football,22-Dec 12:00,Campionato Primavera 1,Atalanta U20 v Juventus U20
1620,Football,22-Dec 12:00,Indonesia Liga 1,Semen Padang v Persija Jakarta
1621,Football,22-Dec 12:00,Kenya Premier League,Kakamega Homeboyz v Kenya Police
1622,Football,22-Dec 12:00,Turkey Division 3/1,Bursa Yildirim Spor v Inegol Kafkas
1623,Football,22-Dec 12:00,Kenya Premier League,Sofapaka v FC Kariobangi Sharks
1624,Football,22-Dec 12:30,Egypt Cup,Al Masry v Dekernes
1625,Football,22-Dec 12:45,Oman Elite League,Al Shabab (KSA) v Al Nasr (Oman)
1626,Football,22-Dec 12:45,HKPL U22 League,Southern District RSA U22 v Kowloon City District SA U22
1627,Football,22-Dec 12:50,U23 Pro League,Al Nasr SC (Dubai) U23 v Al Bataeh Club U23
