,Sport,Date,Competition,Description
2282,Handball,21-Dec 19:30,France Pro A,Tremblay En France v Selestat Alsace HB
2283,Handball,22-Dec 14:00,Turkey Superlig,Giresunspor v Trabzonspor
2284,Handball,22-Dec 18:00,Sweden Elitserien (Womens),Hoors HK H 65 Women v HK Aranas Women
2285,Handball,22-Dec 19:30,Poland Ekstraklasa,Gwardia Opole v Azoty-Pulawy
2286,Handball,23-Dec 12:00,Romania Liga Nationala Women,Danubius Galati Women v CS Gloria 2018 Bistrita-Nasaud Women
2287,Handball,23-Dec 18:00,Germany Bundesliga,SC Magdeburg v THW Kiel
2288,Handball,23-Dec 18:15,Switzerland Nationalliga A,HC Kriens-Luzern v BSV Bern Muri
2289,Handball,23-Dec 18:30,Germany 2 Bundesliga,Die Eulen Ludwigshafen v HSG Nordhorn-Lingen
2290,Handball,23-Dec 19:00,Germany Bundesliga,HSV Hamburg v Fuchse Berlin
2291,Handball,24-Dec 12:00,Turkey Superlig,Giresunspor v Trabzonspor
2292,Handball,25-Dec 05:00,South Korean Handball League,SK Hawks v Hanam City
2293,Handball,25-Dec 07:00,South Korean Handball League,Sangmu Phoenix v Chungnam Athletic
2294,Handball,25-Dec 09:00,South Korean Handball League,Doosan v Incheon City
2295,Handball,26-Dec 12:15,Sweden Elitserien,IK Savehof v VasterasIrsta HF
2296,Handball,26-Dec 13:30,Germany 2 Bundesliga,VfL Eintracht Hagen v VfL Potsdam
2297,Handball,26-Dec 14:00,Sweden Allsvenskan,Lugi HF v HK Varberg
2298,Handball,26-Dec 14:00,Sweden Elitserien (Womens),IK Savehof Women v Vasterasirsta Women
2299,Handball,26-Dec 15:00,Germany 2 Bundesliga,TV 05/07 Huttenberg v Die Eulen Ludwigshafen
2300,Handball,26-Dec 15:00,Sweden Elitserien,Alingsas HK v HIF Karlskrona
2301,Handball,26-Dec 15:00,Sweden Allsvenskan,Vinslovs v Enkopings HF
2302,Handball,26-Dec 15:00,Germany 2 Bundesliga,Desslau Rosslauer HV v HC Elbflorenz 2006 Dresden
2303,Handball,26-Dec 15:00,Germany 2 Bundesliga,Oppenweiler/Backnang v TuS N-Lubbecke
2304,Handball,26-Dec 15:00,Germany 2 Bundesliga,Oppenweiler/Backnang v TuS N-Lubbecke
2305,Handball,26-Dec 15:00,Germany 2 Bundesliga,TUSEM Essen v Ferndorf
2306,Handball,26-Dec 16:00,Sweden Elitserien,IF Hallby HK v IFK Kristianstad
2307,Handball,26-Dec 16:30,Germany Bundesliga,MT Melsungen v TVB 1898 Stuttgart
2308,Handball,26-Dec 16:30,Germany Bundesliga,THW Kiel v HC Erlangen
2309,Handball,26-Dec 16:30,Germany Bundesliga,SG Flensburg-Handewitt v Bergischer HC
2310,Handball,26-Dec 16:30,Germany Bundesliga,TBV Lemgo v HSG Wetzlar
2311,Handball,26-Dec 18:00,Sweden Elitserien,HK Malmo v Helsingborg
2312,Handball,27-Dec 13:00,Sweden Allsvenskan,HK Drott Halmstad v Redbergslids IK
2313,Handball,27-Dec 13:00,Sweden Elitserien,Onnereds HK v Eskilstuna Guif
2314,Handball,27-Dec 14:00,Sweden Allsvenskan,IFK Ystad HK v HK Aranas
2315,Handball,27-Dec 14:00,Sweden Elitserien,Skövde v Ystads IF
2316,Handball,27-Dec 16:00,Poland Ekstraklasa Women,Sosnica Gliwice Women v MKS Lublin Women
2317,Handball,27-Dec 16:00,Poland Ekstraklasa Women,HC Galytchanka Lviv Women v MKS Urbis Gniezno Women
2318,Handball,27-Dec 16:00,Poland Ekstraklasa Women,MKS Piotrcovia Piotrkow Tryb Women v Metraco Zaglebie Lubin Women
2319,Handball,27-Dec 16:00,Poland Ekstraklasa Women,KPR Ruch Chorzow Women v Start Elblag Women
2320,Handball,27-Dec 16:00,Poland Ekstraklasa Women,Energa AZS Koszalin Women v KPR Gminy Kobierzyce Women
2321,Handball,27-Dec 17:00,Sweden Elitserien,Alstermo IF v Hammarby IF HF
2322,Handball,27-Dec 17:00,Germany Bundesliga,ThSV Eisenach v SC Magdeburg
2323,Handball,27-Dec 17:00,Germany Bundesliga,VfL Gummersbach v HSV Hamburg
2324,Handball,27-Dec 17:00,Germany 2 Bundesliga,TSV Bayer Dormagen v VfL Bad Schwartau
2325,Handball,27-Dec 17:00,Germany Bundesliga (W),Oldenburg Women v HSG Blomberg-Lippe Women
2326,Handball,27-Dec 17:00,Germany 2 Bundesliga,TV Grosswallstadt v HSC 2000 Coburg
2327,Handball,27-Dec 17:00,Germany Bundesliga (W),HSG Bensheim/Auerbach Women v SV Union Halle-Neustadt Women
2328,Handball,27-Dec 17:00,Germany Bundesliga (W),Sachsen Zwickau Women v Thuringer HC Women
2329,Handball,27-Dec 18:00,Germany Bundesliga,Fuchse Berlin v Frisch Auf Goppingen
2330,Handball,27-Dec 18:00,Germany Bundesliga,SC DHfK Leipzig v Rhein-Neckar Lowen
2331,Handball,27-Dec 18:00,Germany Bundesliga (W),Borussia Dortmund Women v Frisch Auf Goppingen Women
2332,Handball,27-Dec 18:30,Germany 2 Bundesliga,SG BBM Bietigheim v HBW Balingen-Weilstetten
2333,Handball,27-Dec 18:30,Germany Bundesliga (W),TuS Metzingen Women v Neckarsulmer SU Women
2334,Handball,27-Dec 19:00,Germany Bundesliga,TSV Hannover-Burgdorf v TSV GWD Minden
2335,Handball,27-Dec 19:00,Germany Bundesliga,TSV Hannover-Burgdorf v TSV GWD Minden
2336,Handball,28-Dec 15:00,Germany Bundesliga (W),Ludwigsburg Women v Buxtehuder SV Women
2337,Handball,28-Dec 16:00,Germany 2 Bundesliga,HSG Krefeld v HSG Nordhorn-Lingen
2338,Handball,28-Dec 18:00,Norway NM Cup (Womens),Larvik Women v Storhamar Handball Elite Women
2339,Handball,28-Dec 18:00,Norway NM Cup,Kolstad v Runar
2340,HorseRacing,21-Dec 10:35,Kenilworth,{2025-12-21T10:35:00.0000000Z} 0m 4f 214y
2341,HorseRacing,21-Dec 11:10,Kenilworth,{2025-12-21T11:10:00.0000000Z} 0m 5f 212y
2342,HorseRacing,21-Dec 11:45,Kenilworth,{2025-12-21T11:45:00.0000000Z} 0m 7f 101y
2343,HorseRacing,21-Dec 12:15,Fakenham,{2025-12-21T12:15:00.0000000Z} 2m 0f 3y
2344,HorseRacing,21-Dec 12:20,Kenilworth,{2025-12-21T12:20:00.0000000Z} 0m 7f 101y
2345,HorseRacing,21-Dec 12:30,Lingfield,{2025-12-21T12:30:00.0000000Z} 2m 0f 0y
2346,HorseRacing,21-Dec 12:45,Fakenham,{2025-12-21T12:45:00.0000000Z} 2m 0f 3y
2347,HorseRacing,21-Dec 12:55,Kenilworth,{2025-12-21T12:55:00.0000000Z} 1m 0f 209y
2348,HorseRacing,21-Dec 13:00,Lingfield,{2025-12-21T13:00:00.0000000Z} 2m 0f 0y
2349,HorseRacing,21-Dec 13:15,Fakenham,{2025-12-21T13:15:00.0000000Z} 2m 5f 44y
2350,HorseRacing,21-Dec 13:30,Lingfield,{2025-12-21T13:30:00.0000000Z} 2m 3f 110y
2351,HorseRacing,21-Dec 13:35,Kenilworth,{2025-12-21T13:35:00.0000000Z} 0m 5f 212y
2352,HorseRacing,21-Dec 13:45,Fakenham,{2025-12-21T13:45:00.0000000Z} 2m 4f 1y
2353,HorseRacing,21-Dec 14:00,Lingfield,{2025-12-21T14:00:00.0000000Z} 2m 7f 0y
2354,HorseRacing,21-Dec 14:10,Kenilworth,{2025-12-21T14:10:00.0000000Z} 0m 5f 212y
2355,HorseRacing,21-Dec 14:15,Fakenham,{2025-12-21T14:15:00.0000000Z} 2m 5f 44y
2356,HorseRacing,21-Dec 14:30,Lingfield,{2025-12-21T14:30:00.0000000Z} 2m 0f 0y
2357,HorseRacing,21-Dec 14:43,Kenilworth,{2025-12-21T14:43:00.0000000Z} 0m 5f 212y
2358,HorseRacing,21-Dec 14:45,Fakenham,{2025-12-21T14:45:00.0000000Z} 3m 5f 24y
2359,HorseRacing,21-Dec 15:00,Lingfield,{2025-12-21T15:00:00.0000000Z} 2m 6f 10y
2360,HorseRacing,21-Dec 15:15,Fakenham,{2025-12-21T15:15:00.0000000Z} 2m 7f 95y
2361,HorseRacing,21-Dec 15:20,Kenilworth,{2025-12-21T15:20:00.0000000Z} 0m 5f 212y
2362,HorseRacing,21-Dec 15:30,Lingfield,{2025-12-21T15:30:00.0000000Z} 2m 3f 110y
2363,HorseRacing,22-Dec 02:15,Tamworth,{2025-12-22T02:15:00.0000000Z} 1m 2f 96y
2364,HorseRacing,22-Dec 02:50,Tamworth,{2025-12-22T02:50:00.0000000Z} 0m 7f 209y
2365,HorseRacing,22-Dec 03:25,Tamworth,{2025-12-22T03:25:00.0000000Z} 0m 7f 209y
2366,HorseRacing,22-Dec 04:05,Tamworth,{2025-12-22T04:05:00.0000000Z} 0m 5f 212y
2367,HorseRacing,22-Dec 04:40,Tamworth,{2025-12-22T04:40:00.0000000Z} 0m 4f 213y
2368,HorseRacing,22-Dec 05:15,Tamworth,{2025-12-22T05:15:00.0000000Z} 0m 4f 213y
2369,HorseRacing,22-Dec 05:50,Tamworth,{2025-12-22T05:50:00.0000000Z} 0m 5f 212y
2370,HorseRacing,22-Dec 06:25,Tamworth,{2025-12-22T06:25:00.0000000Z} 0m 6f 211y
2371,HorseRacing,22-Dec 06:25,Tamworth,{2025-12-22T06:25:00.0000000Z} 0m 6f 211y
2372,IceHockey,21-Dec 11:00,Latvia LHL,Energija Elektrenai v HS Riga
2373,IceHockey,21-Dec 12:00,Latvia LHL,HC Panter v Hockey Punks Vilnius
2374,IceHockey,21-Dec 13:00,Kazakhstan Championship,Saryarka Karagandy v HC Beybarys
2375,IceHockey,21-Dec 13:00,Germany DEL,SERC Wild Wings v Nurnberg Ice Tigers
2376,IceHockey,21-Dec 13:00,Germany DEL,Fischtown Pinguins v EHC Munchen
2377,IceHockey,21-Dec 13:00,Germany DEL,Grizzly Adams Wolfsburg v Adler Mannheim
2378,IceHockey,21-Dec 13:00,Kazakhstan Championship,HC Arlan v HC Almaty
2379,IceHockey,21-Dec 14:00,Germany DEL 2,Eispiraten Crimmitschau v ESV Kaufbeuren
2380,IceHockey,21-Dec 14:00,Slovakia Extraliga,HK Dukla Michalovce v HK SKP Poprad
2381,IceHockey,21-Dec 14:00,Austria OEL,EC Red Bull Salzburg v Moser Medical Graz 99ers
2382,IceHockey,21-Dec 14:00,Danish Metal Ligaen,Frederikshavn White Hawks v Rungsted Hockey
2383,IceHockey,21-Dec 14:00,Danish Metal Ligaen,SonderjyskE Ishockey v Herlev Eagles
2384,IceHockey,21-Dec 14:30,Czechia 1. Liga,Pirati Chomutov v HC Tabor
2385,IceHockey,21-Dec 14:30,Slovakia Extraliga,Dukla Trencin v HKM Zvolen
2386,IceHockey,21-Dec 14:30,Danish Metal Ligaen,Odense Bulldogs v Rodovre Mighty Bulls
2387,IceHockey,21-Dec 15:00,Hungary Erste Liga,Dunaujvarosi Acelbikak v ASC Corona Brasov
2388,IceHockey,21-Dec 15:00,Czechia 1. Liga,HC RT Torax Poruba v SK Horacka Slavia Trebic
2389,IceHockey,21-Dec 15:00,Czechia 1. Liga,SC Kolin v Slavia Prague
2390,IceHockey,21-Dec 15:00,Czechia Extraliga,HC Mountfield v HC Kometa Brno
2391,IceHockey,21-Dec 15:00,Czechia Extraliga,Bili Tygri Liberec v Rytiri Kladno
2392,IceHockey,21-Dec 15:00,Czechia Extraliga,BK Mlada Boleslav v HC Energie Karlovy Vary
2393,IceHockey,21-Dec 15:00,Austria OEL,BEMER Pioneers Vorarlberg v HDD Telemach Olimpija Ljubljana
2394,IceHockey,21-Dec 15:00,Czechia Extraliga,HC Sparta Prague v HC Vitkovice Ridera
2395,IceHockey,21-Dec 15:00,Switzerland NLB,EHC Winterthur v Chur
2396,IceHockey,21-Dec 15:00,Austria OEL,SAPA Fehervar AV19 v EHC Black Wings Linz
2397,IceHockey,21-Dec 15:00,Slovakia Extraliga,Spisska Nova Ves v HC 21 Presov
2398,IceHockey,21-Dec 15:00,Slovakia Extraliga,HC Kosice v Liptovsky Mikulas
2399,IceHockey,21-Dec 15:00,Poland Hockey League,JKH GKS Jastrzebie v GKS Tychy
2400,IceHockey,21-Dec 15:30,Germany DEL,Augsburger Panther v Straubing Tigers
2401,IceHockey,21-Dec 15:30,Germany DEL,Iserlohn Roosters v Lowen Frankfurt
2402,IceHockey,21-Dec 15:30,Germany DEL,Dresdner Eislowen v ERC Ingolstadt
2403,IceHockey,21-Dec 15:30,France Ligue Magnus,Angers v Cergy-Pontoise
2404,IceHockey,21-Dec 15:30,Czechia Extraliga,HC Plzen 1929 v HC Dynamo Pardubice
2405,IceHockey,21-Dec 15:30,Germany DEL,Dresdner Eislowen v ERC Ingolstadt
2406,IceHockey,21-Dec 16:00,Czechia 1. Liga,Pardubice B v Dukla Jihlava
2407,IceHockey,21-Dec 16:00,Poland Hockey League,Zaglebie Sosnowiec SA v Comarch Cracovia
2408,IceHockey,21-Dec 16:00,Germany DEL 2,Regensburg v Krefeld Pinguine
2409,IceHockey,21-Dec 16:00,Czechia 1. Liga,HC Zubr Prerov v PSG Zlin
2410,IceHockey,21-Dec 16:00,Czechia Extraliga,HC Olomouc v HC Verva Litvinov
2411,IceHockey,21-Dec 16:00,Austria OEL,Ferencvarosi TC v Klagenfurt
2412,IceHockey,21-Dec 16:00,Germany DEL 2,Dusseldorfer EG v Wolfe Freiburg
2413,IceHockey,21-Dec 16:00,Germany DEL 2,Landshut Cannibals v Starbulls Rosenheim
2414,IceHockey,21-Dec 16:00,Czech Republic 1. Liga,HC Frydek-Mistek v HC Banik Sokolov
2415,IceHockey,21-Dec 16:00,Switzerland NLB,EHC Arosa v Hockey Thurgau
2416,IceHockey,21-Dec 16:00,Czechia 1. Liga,VHK Vsetin v HC Stadion Litomerice
2417,IceHockey,21-Dec 16:00,Slovakia Extraliga,MsHK Zilina v HC Slovan Bratislava
2418,IceHockey,21-Dec 16:00,Czechia Extraliga,CEZ Ceske Budejovice v HC Ocelari Trinec
2419,IceHockey,21-Dec 16:00,Poland Hockey League,Ciarko PBS Bank Sanok v Nesta Karawela Torun
2420,IceHockey,21-Dec 16:00,Germany DEL 2,SC Bietigheim Steelers v Lausitzer Fuchse
2421,IceHockey,21-Dec 16:00,Switzerland NLB,La Chaux Fonds v Basel
2422,IceHockey,21-Dec 16:00,Great Britain Elite League,Nottingham Panthers v Guildford Flames
2423,IceHockey,21-Dec 16:30,Switzerland NLB,EHC Olten v GCK Lions
2424,IceHockey,21-Dec 16:30,Austria OEL,HC TWK Innsbruck v Villach
2425,IceHockey,21-Dec 16:30,Slovakia Extraliga,HK Nitra v HC 05 Ban Bystrica
2426,IceHockey,21-Dec 16:40,Hungary Erste Liga,MAC Budapest v Gyergyoi HK
2427,IceHockey,21-Dec 17:00,Austria OEL,Valpusteria v UPC Vienna Capitals
2428,IceHockey,21-Dec 17:00,Hungary Erste Liga,DVTK Jegesmedvek v Ujpest TE
2429,IceHockey,21-Dec 17:00,Poland Hockey League,Polonia Bytom v Unia Oswiecim
2430,IceHockey,21-Dec 17:00,Great Britain Elite League,Belfast Giants v Dundee Stars
2431,IceHockey,21-Dec 17:00,France Ligue Magnus,Rouen Dragons v Marseille
2432,IceHockey,21-Dec 17:00,PWHL,New York Sirens Women v Toronto Sceptres Women
2433,IceHockey,21-Dec 17:30,Germany DEL 2,EC Bad Nauheim v Kassel Huskies
2434,IceHockey,21-Dec 17:30,France Ligue Magnus,Bordeaux Boxers v Grenoble
2435,IceHockey,21-Dec 17:30,Great Britain Elite League,Manchester Storm v Cardiff Devils
2436,IceHockey,21-Dec 17:30,Germany DEL 2,EC Bad Nauheim v Kassel Huskies
2437,IceHockey,21-Dec 17:30,Great Britain Elite League,Coventry Blaze v Sheffield Steelers
2438,IceHockey,21-Dec 17:30,Hungary Erste Liga,DEAC v HSC Csikszereda
2439,IceHockey,21-Dec 17:30,France Ligue Magnus,GAP v HC Amiens
2440,IceHockey,21-Dec 17:30,Germany DEL 2,Weiden v Ravensburg Towerstars
2441,IceHockey,21-Dec 18:00,France Ligue Magnus,Anglet Hormadi Elite v Nice Aigles
2442,IceHockey,21-Dec 18:00,Germany DEL,Eisbaren Berlin v Kolner Haie
2443,IceHockey,21-Dec 18:05,US NHL,Washington Capitals @ Detroit Red Wings
2444,IceHockey,21-Dec 19:00,PWHL,Minnesota Frost Women v Ottawa Charge Women
2445,IceHockey,21-Dec 19:05,France Ligue Magnus,Chamonix v Briancon
2446,IceHockey,21-Dec 20:00,AHL,Rockford IceHogs @ Manitoba Moose
2447,IceHockey,21-Dec 20:00,AHL,Toronto Marlies @ Belleville Senators
2448,IceHockey,21-Dec 20:00,US ECHL,Norfolk Admirals @ Adirondack Thunder
2449,IceHockey,21-Dec 20:00,US ECHL,Florida Everblades @ Savannah Ghost Pirates
2450,IceHockey,21-Dec 20:05,US ECHL,Orlando Solar Bears @ South Carolina Stingrays
2451,IceHockey,21-Dec 20:05,AHL,Hershey Bears @ Wilkes-Barre/Scranton Penguins
2452,IceHockey,21-Dec 20:10,US ECHL,Greenville Swamp Rabbits @ Atlanta Gladiators
2453,IceHockey,21-Dec 21:00,AHL,Springfield Thunderbirds @ Charlotte Checkers
2454,IceHockey,21-Dec 21:00,AHL,Cleveland Monsters @ Grand Rapids Griffins
2455,IceHockey,21-Dec 21:00,AHL,San Diego Gulls @ Calgary Wranglers
2456,IceHockey,21-Dec 21:05,US ECHL,Utah Grizzlies @ Tulsa Oilers
2457,IceHockey,21-Dec 22:00,PWHL,Seattle Torrent Women v Boston Fleet Women
2458,IceHockey,21-Dec 22:05,AHL,Henderson Silver Knights @ Colorado Eagles
2459,IceHockey,21-Dec 22:05,US ECHL,Allen Americans @ Kansas City Mavericks
2460,IceHockey,21-Dec 23:00,AHL,San Jose Barracuda @ Ontario Reign
2461,IceHockey,21-Dec 23:05,US NHL,Colorado Avalanche @ Minnesota Wild
2462,IceHockey,22-Dec 00:05,US NHL,Buffalo Sabres @ New Jersey Devils
2463,IceHockey,22-Dec 00:05,US NHL,Winnipeg Jets @ Utah Mammoth
2464,IceHockey,22-Dec 00:05,US NHL,New York Rangers @ Nashville Predators
2465,IceHockey,22-Dec 00:05,US NHL,Buffalo Sabres @ New Jersey Devils
2466,IceHockey,22-Dec 00:05,US NHL,Toronto Maple Leafs @ Dallas Stars
2467,IceHockey,22-Dec 00:05,US NHL,Winnipeg Jets @ Utah Mammoth
2468,IceHockey,22-Dec 00:05,US NHL,Ottawa Senators @ Boston Bruins
2469,IceHockey,22-Dec 01:05,US NHL,Vegas Golden Knights @ Edmonton Oilers
2470,IceHockey,22-Dec 13:00,Kazakhstan Championship,Saryarka Karagandy v HC Beybarys
2471,IceHockey,22-Dec 14:00,Kazakhstan Championship,Gornyak Rudnyi v HC Aktobe
2472,IceHockey,22-Dec 14:00,Kazakhstan Championship,Yertis Pavlodar v Kazzinc Torpedo
2473,IceHockey,22-Dec 16:30,Latvia LHL,HK Liepaja v Kyiv Capitals
2474,IceHockey,22-Dec 16:30,Czechia 2. Liga,HC AZ Havirov 2010 v LHK Jestrabi Prostejov
2475,IceHockey,22-Dec 17:30,Czechia 2. Liga,Kadan v HC Vrchlabi
2476,IceHockey,22-Dec 18:00,Danish Metal Ligaen,Blue Fox Herning v Aalborg Pirates
2477,IceHockey,22-Dec 18:30,Austria Alps Hockey League,KHL Sisak v EK Zeller Eisbaren
2478,IceHockey,22-Dec 18:30,Austria Alps Hockey League,HC Meran/o Pircher v EC Red Bull Salzburg U20
2479,IceHockey,22-Dec 18:45,Switzerland NLA,Lausanne HC v SC Bern
2480,IceHockey,22-Dec 18:45,Switzerland NLA,HC Lugano v HC Ajoie
2481,IceHockey,22-Dec 19:00,Austria Alps Hockey League,Ritten Sport v HK Acroni Jesenice
2482,IceHockey,22-Dec 19:00,Austria Alps Hockey League,Hockey Unterland Cavaliers v EC Die Adler Stadtwerke Kitzbuhel
2483,IceHockey,22-Dec 19:15,Switzerland NLB,GDT Bellinzona v EHC Visp
2484,IceHockey,22-Dec 19:30,Austria Alps Hockey League,SG Cortina v Supermercati Migross Asiago
2485,IceHockey,22-Dec 19:30,Austria Alps Hockey League,HC Gherdeina v Vipiteno Broncos
2486,IceHockey,23-Dec 00:05,US NHL,St Louis Blues @ Tampa Bay Lightning
2487,IceHockey,23-Dec 00:35,US NHL,Vancouver Canucks @ Philadelphia Flyers
2488,IceHockey,23-Dec 03:05,US NHL,Columbus Blue Jackets @ Los Angeles Kings
2489,IceHockey,23-Dec 03:05,US NHL,Seattle Kraken @ Anaheim Ducks
2490,IceHockey,23-Dec 14:00,Kazakhstan Championship,Gornyak Rudnyi v HC Aktobe
2491,IceHockey,23-Dec 14:00,Kazakhstan Championship,Saryarka Karagandy v HC Beybarys
2492,IceHockey,23-Dec 14:00,Kazakhstan Championship,Yertis Pavlodar v Kazzinc Torpedo
2493,IceHockey,23-Dec 15:00,Czechia Extraliga,HC Energie Karlovy Vary v CEZ Ceske Budejovice
2494,IceHockey,23-Dec 16:00,Czech Republic Extraliga,HC Ocelari Trinec v HC Mountfield
2495,IceHockey,23-Dec 16:00,Latvia LHL,HK Liepaja v Kyiv Capitals
2496,IceHockey,23-Dec 16:00,Latvia LHL,HK Liepaja v Kyiv Capitals
2497,IceHockey,23-Dec 16:30,Czechia Extraliga,HC Verva Litvinov v BK Mlada Boleslav
2498,IceHockey,23-Dec 16:30,Czechia Extraliga,HC Vitkovice Ridera v Bili Tygri Liberec
2499,IceHockey,23-Dec 17:00,Czechia Extraliga,HC Sparta Prague v HC Olomouc
2500,IceHockey,23-Dec 17:00,Czechia Extraliga,Rytiri Kladno v HC Dynamo Pardubice
2501,IceHockey,23-Dec 17:00,Latvia LHL,Zemgale/JLSS v HC Panter
2502,IceHockey,23-Dec 17:00,Czechia Extraliga,HC Kometa Brno v HC Plzen 1929
2503,IceHockey,23-Dec 17:30,Czech Republic Extraliga,HC Sparta Prague v HC Olomouc
2504,IceHockey,23-Dec 17:30,Switzerland NLB,Chur v EHC Visp
2505,IceHockey,23-Dec 18:30,Germany DEL,Lowen Frankfurt v Kolner Haie
2506,IceHockey,23-Dec 18:30,Germany DEL,Augsburger Panther v Nurnberg Ice Tigers
2507,IceHockey,23-Dec 18:30,Germany DEL,ERC Ingolstadt v EHC Munchen
2508,IceHockey,23-Dec 18:30,Germany DEL,Grizzly Adams Wolfsburg v Iserlohn Roosters
2509,IceHockey,23-Dec 18:30,Germany DEL,SERC Wild Wings v Fischtown Pinguins
2510,IceHockey,23-Dec 18:30,Germany DEL,Adler Mannheim v Eisbaren Berlin
2511,IceHockey,23-Dec 18:30,Germany DEL,Straubing Tigers v Dresdner Eislowen
2512,IceHockey,23-Dec 18:30,Germany DEL 2,EC Bad Nauheim v Landshut Cannibals
2513,IceHockey,23-Dec 18:30,Germany DEL 2,Wolfe Freiburg v SC Bietigheim Steelers
2514,IceHockey,23-Dec 18:30,Germany DEL 2,Kassel Huskies v Weiden
2515,IceHockey,23-Dec 18:30,Germany DEL 2,Lausitzer Fuchse v ESV Kaufbeuren
2516,IceHockey,23-Dec 18:30,Germany DEL 2,Starbulls Rosenheim v Eispiraten Crimmitschau
2517,IceHockey,23-Dec 18:45,Switzerland NLA,HC Ambri-Piotta v HC Ajoie
2518,IceHockey,23-Dec 18:45,Switzerland NLA,ZSC Lions v EHC Biel
2519,IceHockey,23-Dec 18:45,Switzerland NLB,Basel v GCK Lions
2520,IceHockey,23-Dec 18:45,Switzerland NLA,SC Bern v Rapperswil-Jona Lakers
2521,IceHockey,23-Dec 18:45,Switzerland NLB,Hockey Thurgau v GDT Bellinzona
2522,IceHockey,23-Dec 18:45,Switzerland NLA,Geneve-Servette HC v Lausanne HC
2523,IceHockey,23-Dec 18:45,Switzerland NLA,Kloten-Flyers v HC Fribourg-Gotteron
2524,IceHockey,23-Dec 18:45,Switzerland NLA,SCL Tigers v HC Lugano
2525,IceHockey,23-Dec 18:45,Switzerland NLA,EV Zug v HC Davos
2526,IceHockey,23-Dec 18:45,Switzerland NLB,EHC Olten v EHC Winterthur
2527,IceHockey,23-Dec 18:45,Switzerland NLB,EHC Olten v EHC Winterthur
2528,IceHockey,23-Dec 19:00,Germany DEL 2,Regensburg v Dusseldorfer EG
2529,IceHockey,23-Dec 19:00,Switzerland NLB,HC Sierre v EHC Arosa
2530,IceHockey,23-Dec 19:00,France Ligue Magnus,GAP v Chamonix
2531,IceHockey,23-Dec 19:00,Germany DEL 2,Ravensburg Towerstars v Krefeld Pinguine
2532,IceHockey,23-Dec 19:15,France Ligue Magnus,Marseille v Briancon
2533,IceHockey,23-Dec 19:15,France Ligue Magnus,Grenoble v Angers
2534,IceHockey,23-Dec 19:15,France Ligue Magnus,HC Amiens v Bordeaux Boxers
2535,IceHockey,23-Dec 19:30,France Ligue Magnus,Cergy-Pontoise v Anglet Hormadi Elite
2536,IceHockey,23-Dec 19:30,Great Britain Elite League,Manchester Storm v Dundee Stars
2537,IceHockey,23-Dec 19:30,France Ligue Magnus,Nice Aigles v Rouen Dragons
2538,IceHockey,23-Dec 21:05,US NHL,Pittsburgh Penguins @ Toronto Maple Leafs
2539,IceHockey,23-Dec 23:35,US NHL,Dallas Stars @ Detroit Red Wings
2540,IceHockey,24-Dec 00:00,PWHL,Toronto Sceptres Women v Ottawa Charge Women
2541,IceHockey,24-Dec 00:05,US NHL,New York Rangers @ Washington Capitals
2542,IceHockey,24-Dec 00:05,US NHL,Montreal Canadiens @ Boston Bruins
2543,IceHockey,24-Dec 00:05,US NHL,New Jersey Devils @ New York Islanders
2544,IceHockey,24-Dec 00:05,US NHL,Florida Panthers @ Carolina Hurricanes
2545,IceHockey,24-Dec 00:05,US NHL,Buffalo Sabres @ Ottawa Senators
2546,IceHockey,24-Dec 01:05,US NHL,Nashville Predators @ Minnesota Wild
2547,IceHockey,24-Dec 02:05,US NHL,Philadelphia Flyers @ Chicago Blackhawks
2548,IceHockey,24-Dec 02:05,US NHL,Utah Mammoth @ Colorado Avalanche
2549,IceHockey,24-Dec 02:05,US NHL,Calgary Flames @ Edmonton Oilers
2550,IceHockey,24-Dec 03:00,PWHL,Seattle Torrent Women v Montreal Victoire Women
2551,IceHockey,24-Dec 03:05,US NHL,San Jose Sharks @ Vegas Golden Knights
2552,IceHockey,24-Dec 03:05,US NHL,Seattle Kraken @ Los Angeles Kings
2553,IceHockey,24-Dec 14:00,Kazakhstan Championship,Saryarka Karagandy v HC Beybarys
2554,IceHockey,26-Dec 13:00,Hungary Erste Liga,Dunaujvarosi Acelbikak v Fehervar Titanok
2555,IceHockey,26-Dec 13:00,Germany DEL,Kolner Haie v Fischtown Pinguins
2556,IceHockey,26-Dec 14:00,Finland SM-Liiga,Tappara v Pelicans
2557,IceHockey,26-Dec 14:00,Kazakhstan Championship,Yertis Pavlodar v HC Nomad
2558,IceHockey,26-Dec 14:00,Kazakhstan Championship,Yertis Pavlodar v HC Nomad
2559,IceHockey,26-Dec 14:10,Spengler Cup,HC Fribourg-Gotteron v HC Sparta Prague
2560,IceHockey,26-Dec 14:15,Sweden Hockey League,Farjestad BK v Linkopings HC
2561,IceHockey,26-Dec 14:15,Sweden Hockey League,Orebro Hockeyklubb v HV 71
2562,IceHockey,26-Dec 14:15,Sweden Hockey League,Vaxjo Lakers HC v IF Malmo Redhawks
2563,IceHockey,26-Dec 15:00,Czechia Extraliga,Bili Tygri Liberec v HC Energie Karlovy Vary
2564,IceHockey,26-Dec 15:00,Czechia Extraliga,HC Mountfield v HC Verva Litvinov
2565,IceHockey,26-Dec 15:00,Slovakia Extraliga,HKM Zvolen v HC 05 Ban Bystrica
2566,IceHockey,26-Dec 15:00,Czechia Extraliga,BK Mlada Boleslav v HC Sparta Prague
2567,IceHockey,26-Dec 15:00,Slovakia Extraliga,HC Slovan Bratislava v Dukla Trencin
2568,IceHockey,26-Dec 15:00,Slovakia Extraliga,HK Nitra v MsHK Zilina
2569,IceHockey,26-Dec 15:30,Germany DEL,Eisbaren Berlin v Grizzly Adams Wolfsburg
2570,IceHockey,26-Dec 15:30,Czechia Extraliga,HC Plzen 1929 v Rytiri Kladno
2571,IceHockey,26-Dec 15:30,Germany DEL,Adler Mannheim v ERC Ingolstadt
2572,IceHockey,26-Dec 15:30,Germany DEL,Nurnberg Ice Tigers v Straubing Tigers
2573,IceHockey,26-Dec 16:00,Czechia Extraliga,CEZ Ceske Budejovice v HC Kometa Brno
2574,IceHockey,26-Dec 16:00,Germany DEL 2,Dusseldorfer EG v Kassel Huskies
2575,IceHockey,26-Dec 16:00,Czechia Extraliga,HC Dynamo Pardubice v HC Ocelari Trinec
2576,IceHockey,26-Dec 16:00,Germany DEL 2,Krefeld Pinguine v Starbulls Rosenheim
2577,IceHockey,26-Dec 16:00,Czechia Extraliga,HC Olomouc v HC Vitkovice Ridera
2578,IceHockey,26-Dec 16:00,Germany DEL 2,SC Bietigheim Steelers v Ravensburg Towerstars
2579,IceHockey,26-Dec 16:00,Germany DEL 2,Eispiraten Crimmitschau v EC Bad Nauheim
2580,IceHockey,26-Dec 16:00,Great Britain Elite League,Sheffield Steelers v Nottingham Panthers
2581,IceHockey,26-Dec 16:00,Germany DEL 2,Landshut Cannibals v Regensburg
2582,IceHockey,26-Dec 16:00,Great Britain Elite League,Cardiff Devils v Coventry Blaze
2583,IceHockey,26-Dec 16:30,Finland SM-Liiga,HPK v Ilves
2584,IceHockey,26-Dec 16:30,Finland SM-Liiga,Lukko v Vaasan Sport
2585,IceHockey,26-Dec 16:30,Finland SM-Liiga,JYP v Oulun Karpat
2586,IceHockey,26-Dec 16:30,Finland SM-Liiga,TPS v Kiekko Espoo
2587,IceHockey,26-Dec 16:30,Finland SM-Liiga,SaiPa v KalPa
2588,IceHockey,26-Dec 16:30,Slovakia Extraliga,Spisska Nova Ves v Liptovsky Mikulas
2589,IceHockey,26-Dec 16:30,Slovakia Extraliga,Spisska Nova Ves v Liptovsky Mikulas
2590,IceHockey,26-Dec 16:30,Austria OEL,HC TWK Innsbruck v Valpusteria
2591,IceHockey,26-Dec 16:30,Slovakia Extraliga,HC Kosice v HK Dukla Michalovce
2592,IceHockey,26-Dec 16:30,Austria OEL,Moser Medical Graz 99ers v EHC Black Wings Linz
2593,IceHockey,26-Dec 16:30,Austria OEL,SAPA Fehervar AV19 v UPC Vienna Capitals
2594,IceHockey,26-Dec 16:30,Austria OEL,Klagenfurt v Villach
2595,IceHockey,26-Dec 16:30,Hungary Erste Liga,HSC Csikszereda v ASC Corona Brasov
2596,IceHockey,26-Dec 17:00,Sweden Hockey League,Djurgardens IF v Leksands IF
2597,IceHockey,26-Dec 17:00,Slovakia Extraliga,HC 21 Presov v HK SKP Poprad
2598,IceHockey,26-Dec 17:00,Sweden Hockey League,Rogle BK v Frolunda HC
2599,IceHockey,26-Dec 17:00,Hungary Erste Liga,Ujpest TE v DEAC
2600,IceHockey,26-Dec 17:00,Sweden Hockey League,Timra IK v Brynas IF
2601,IceHockey,26-Dec 17:00,Hungary Erste Liga,MAC Budapest v DVTK Jegesmedvek
2602,IceHockey,26-Dec 17:00,Great Britain Elite League,Glasgow Clan v Dundee Stars
2603,IceHockey,26-Dec 17:00,Sweden Hockey League,Lulea HF v Skelleftea AIK
2604,IceHockey,26-Dec 17:00,Austria OEL,BEMER Pioneers Vorarlberg v EC Red Bull Salzburg
2605,IceHockey,26-Dec 17:30,Great Britain Elite League,Manchester Storm v Guildford Flames
2606,IceHockey,26-Dec 17:30,Germany DEL 2,ESV Kaufbeuren v Wolfe Freiburg
2607,IceHockey,26-Dec 17:30,Germany DEL 2,Weiden v Lausitzer Fuchse
2608,IceHockey,26-Dec 18:00,Germany DEL,Iserlohn Roosters v SERC Wild Wings
2609,IceHockey,26-Dec 18:00,Germany DEL,EHC Munchen v Lowen Frankfurt
2610,IceHockey,26-Dec 18:00,Germany DEL,Dresdner Eislowen v Augsburger Panther
2611,IceHockey,26-Dec 18:45,Austria OEL,HC Bolzano v HDD Telemach Olimpija Ljubljana
