Sport,Date,Competition,Description
Football,10-Jan 15:00,Campeonato de Portugal,Lusitano Moncarapachense v Alverca II
Football,10-Jan 15:00,England FA Trophy,Leatherhead v Horsham F.C.
Football,10-Jan 15:00,Campeonato de Portugal,Juventude Evora SC v Atletico Malveira
Football,10-Jan 15:00,England FA Trophy,Kidderminster Harriers v Morecambe
Football,10-Jan 15:00,Campeonato de Portugal,Ribeira Brava v AD Camacha
Football,10-Jan 15:00,England FA Trophy,Hereford FC v AFC Fylde
Football,10-Jan 15:00,England FA Trophy,Hornchurch v Telford
Football,10-Jan 15:00,Northern Ireland Cup,Carrick Rangers v Queen's University
Football,10-Jan 15:00,England FA Trophy,Bath City v Southend
Football,10-Jan 15:00,Northern Ireland Cup,Moyola Park v HW Welders
Football,10-Jan 15:00,Campeonato de Portugal,Electrico v Naval
Football,10-Jan 15:00,Northern Ireland Cup,Linfield v Bangor FC (NIR)
Football,10-Jan 15:00,Campeonato de Portugal,Aparecida v FC Alpendorada
Football,10-Jan 15:00,Campeonato de Portugal,Vila Real v Florgrade
Football,10-Jan 15:00,England FA Trophy,Eastleigh v Southport
Football,10-Jan 15:00,Campeonato de Portugal,Benfica e Castelo Branco v Mortagua
Football,10-Jan 15:00,England FA Trophy,Marine FC v Gloucester City AFC
Football,10-Jan 15:00,Campeonato de Portugal,Serpa v Alcochetense
Football,10-Jan 15:00,England FA Trophy,Yeovil Town v Alvechurch FC
Football,10-Jan 15:00,Northern Ireland Cup,Ballinamallard United v Institute
Football,10-Jan 15:00,Northern Ireland Cup,Armagh City FC v Drumaness Mills FC
Football,10-Jan 15:00,Northern Ireland Cup,Ballymena v Larne
Football,10-Jan 15:00,Campeonato de Portugal,Rebordosa v Cinfaes
Football,10-Jan 15:00,Northern Ireland Cup,Cliftonville v Dundela
Football,10-Jan 15:00,Campeonato de Portugal,Uniao da Serra v Fatima
Football,10-Jan 15:00,Northern Ireland Cup,Portadown v Annagh United
Football,10-Jan 15:00,Northern Ireland Cup,Portadown v Annagh United
Football,10-Jan 15:00,England Southern Premier Central,AFC Sudbury v Bishops Stortford
Football,10-Jan 15:00,Spain Tercera Division,FC Lescala v UE Tona
Football,10-Jan 15:00,England Southern Premier Central,Stamford v St Ives Town
Football,10-Jan 15:00,Spain Tercera Division,Numancia II v Unionistas de Salamanca CF II
Football,10-Jan 15:00,England Southern Premier Central,Royston Town FC v Bury Town
Football,10-Jan 15:00,Spain Tercera Division,UD Melilla B v Huetor Tajar
Football,10-Jan 15:00,Saudi Arabia Pro League,Al-Riyadh v Al Feiha (KSA)
Football,10-Jan 15:00,Spain Tercera Division,CD Avance Ezcabarte v CD Beti Onak
Football,10-Jan 15:00,Malta Premier League,Hamrun Spartans v Sliema Wanderers
Football,10-Jan 15:00,Spain Tercera Division,CD Huarte v CD Pamplona
Football,10-Jan 15:15,Spain Tercera Division,UD Santa Marta v SD Almazan
Football,10-Jan 15:15,Spain Primera RFEF Group 1,Arenas Club de Getxo v Real Madrid B
Football,10-Jan 15:15,Spain Tercera Division,UM Escobedo v CD Montanas del Pas
Football,10-Jan 15:15,Spain Primera Division,Villarreal CF v Alaves
Football,10-Jan 15:15,Spain Segunda Division,FC Andorra v CD Leonesa
Football,10-Jan 15:15,Spain Primera RFEF Group 1,Racing Club Ferrol v Athletic Bilbao B
Football,10-Jan 15:15,Spain Segunda Division,Real Sociedad II v Albacete
Football,10-Jan 15:15,Spain Tercera Division,CD Marchamalo v CD Sonseca
Football,10-Jan 15:15,Spain Primera RFEF Group 1,Arenteiro v CD Lugo
Football,10-Jan 15:30,Ghana Premier League,Hohoe Utd v Hearts of Oak
Football,10-Jan 15:30,Spain Tercera Division,Pasaia Kirol Elkartea v SD Eibar III
Football,10-Jan 15:30,Malta Challenge League,Sirens v Pieta Hotspurs
Football,10-Jan 15:30,Spain Division de Honor U19 - Group 2,Danok Bat CF U19 v Antiguoko KE U19
Football,10-Jan 15:30,Gibraltar Premier Division,Europa Point v Lincoln Red Imps FC
Football,10-Jan 15:30,Spain Tercera Division,CD Estradense v SD Compostela
Football,10-Jan 15:30,Spain Tercera Division,La Almunia v CD Robres
Football,10-Jan 15:30,Spain Tercera Division,Vall de Uxo v CD Utiel
Football,10-Jan 15:30,Israel Premier League,Hapoel Haifa v Hapoel Tel Aviv
Football,10-Jan 15:30,Spain Tercera Division,UD Alzira v CD Bunol
Football,10-Jan 15:30,Netherlands Eerste Divisie,RKC Waalwijk v Jong FC Utrecht
Football,10-Jan 15:30,Spain Tercera Division,UD Collerense v Pena Deportiva
Football,10-Jan 15:30,Spain Segunda B1,Atletico Astorga CF v Real Valladolid II
Football,10-Jan 15:30,Netherlands Eredivisie,AZ Alkmaar v Volendam
Football,10-Jan 15:30,Netherlands Eerste Divisie,RKC Waalwijk v Jong FC Utrecht
Football,10-Jan 15:30,Israel Premier League,Hapoel Haifa v Hapoel Tel Aviv
Football,10-Jan 15:30,Malta Challenge League,Sirens v Pieta Hotspurs
Football,10-Jan 15:30,Ghana Premier League,Hohoe Utd v Hearts of Oak
Football,10-Jan 15:45,United Arab Emirates Premier,Al Wahda (UAE) v Sharjah FC
Football,10-Jan 15:45,Turkey Supercup,Galatasaray v Fenerbahce
Football,10-Jan 16:00,Brazil Sao Paulo Youth Cup,Bragantino U20 v Sao Luis U20
Football,10-Jan 16:00,Brazil Sao Paulo Youth Cup,XV de Piracicaba U20 v AB Projeto Nordeste Canaa U20
Football,10-Jan 16:00,Brazil Sao Paulo Youth Cup,Gremio Novorizontino U20 v Juventude Samas MA U20
Football,10-Jan 16:00,Brazil Sao Paulo Youth Cup,Portuguesa SP U20 v Operario PR U20
Football,10-Jan 16:00,Spain Tercera Division,CD Ciudad Real v Illescas
Football,10-Jan 16:00,Brazil Sao Paulo Youth Cup,Sao Jose EC SP U20 v Nacional Fast Clube Manaus U20
Football,10-Jan 16:00,Spain Tercera Division,Atzeneta UE v UD Castellonense
Football,10-Jan 16:00,Brazil Sao Paulo Youth Cup,AD Centro Olimpico U20 v Confianca PB U20
Football,10-Jan 16:00,France Coupe de France Women,Thonon Evian Grand Geneve FC Women v Marseille Women
Football,10-Jan 16:00,Brazil Sao Paulo Youth Cup,Ituano U20 v Ivinhema U20
Football,10-Jan 16:00,Spain Tercera Division,Mexico FC v CD Leganes II
Football,10-Jan 16:00,Spain Tercera Division,Haro Deportivo v CD Arnedo
Football,10-Jan 16:00,Spain Tercera Division,CD Lagun Onak v Leioa
Football,10-Jan 16:00,Segunda RFEF - Group 1 Women,Viajes Interrias FF Women v Racing Santander Women
Football,10-Jan 16:00,Spain Tercera Division,Santanyi v CE Felanitx
Football,10-Jan 16:00,Spain Tercera Division,CD Son Cladera v Binissalem
Football,10-Jan 16:00,Spain Tercera Division,Pena Sport v CA Artajones
Football,10-Jan 16:00,Mali Premiere Division,USFAS Bamako v Djoliba AC
Football,10-Jan 16:00,Turkey 1. Lig,Sakaryaspor v Bandirmaspor
Football,10-Jan 16:00,France National 3,Auxerre II v Yzeure
Football,10-Jan 16:00,Mauritania Premier League,FC Inter de Nouakchott v FC Nouadhibou
Football,10-Jan 16:00,France National 3,Stade de Reims II v Olympique Saint-Quentinois
Football,10-Jan 16:00,Mauritania Premier League,FC Inter de Nouakchott v FC Nouadhibou
Football,10-Jan 16:00,Spain Tercera Division,Haro Deportivo v CD Arnedo
Football,10-Jan 16:00,Spain Tercera Division,CD Son Cladera v Binissalem
Football,10-Jan 16:00,Segunda RFEF - Group 1 Women,Viajes Interrias FF Women v Racing Santander Women
Football,10-Jan 16:00,Brazil Sao Paulo Youth Cup,Ituano U20 v Ivinhema U20
Football,10-Jan 16:00,Brazil Sao Paulo Youth Cup,AD Centro Olimpico U20 v Confianca PB U20
Football,10-Jan 16:00,Brazil Sao Paulo Youth Cup,Sao Jose EC SP U20 v Nacional Fast Clube Manaus U20
Football,10-Jan 16:00,Brazil Sao Paulo Youth Cup,Portuguesa SP U20 v Operario PR U20
Football,10-Jan 16:00,Spain Tercera Division,SRD Vimenor CF v CD Cayon
Football,10-Jan 16:15,Spain Tercera Division,SD Deusto v CD Aurrera de Vitoria
Football,10-Jan 16:15,Spain Tercera Division,UE Vilassar de Mar v Fundacio Esportima Grama
Football,10-Jan 16:15,Brazil Sao Paulo Youth Cup,Ibrachina U20 v Bangu U20
Football,10-Jan 16:15,Italy Serie B,Juve Stabia v Pescara
Football,10-Jan 16:30,Italy Eccellenza,Pietracuta ASD v SSD Sampierana
Football,10-Jan 16:30,Spain Tercera Division,CF Platges de Calvia v CD Cardassar
Football,10-Jan 16:30,Italy Lega Pro Prima Divisione Girone A,US Pergolettese 1932 v Lumezzane
Football,10-Jan 16:30,Italy Lega Pro Prima Divisione Girone C,Crotone v ASD Altamura
Football,10-Jan 16:30,Italy Lega Pro Prima Divisione Girone A,Pro Patria v Inter U23
Football,10-Jan 16:30,Italy Lega Pro Prima Divisione Girone C,ASD Sorrento 1945 v Foggia
Football,10-Jan 16:30,AFC U23 Championship,Syria U23 v Qatar U23
Football,10-Jan 16:30,Italy Lega Pro Prima Divisione Girone B,Ravenna FC 1913 v Forli
Football,10-Jan 16:30,Spain Tercera Division,AD Ceuta FC II v San Roque Lepe
Football,10-Jan 16:30,Israel Premier League,Irony Tiberias v Hapoel Petach Tikva
Football,10-Jan 16:30,France National 2,ASC Biesheim v Epinal
Football,10-Jan 16:40,Autonomicas - Cataluna,Atletic Sant Just v CE Sabadell II
Football,10-Jan 17:00,France Cup,Le Puy v Reims
Football,10-Jan 17:00,France Cup,Hauts Lyonnais v Lorient
Football,10-Jan 17:00,Spain Tercera Division,Atletico Arteixo v Celtiga
Football,10-Jan 17:00,France Cup,US Avranches v Strasbourg
Football,10-Jan 17:00,France National 2,FC Rousset SVO v Hyeres
Football,10-Jan 17:00,France Cup,Istres v Stade Lavallois
Football,10-Jan 17:00,France Cup,Istres v Stade Lavallois
Football,10-Jan 17:00,France National 2,Voltigeurs de Chateaubriant v AS Montlouis Football
Football,10-Jan 17:00,France National 3,OCPAM v US Le Pays du Valois
Football,10-Jan 17:00,France National 3,Olympique Lyonnais II v Olympique Ales
Football,10-Jan 17:00,France National 2,Wasquehal v Dieppe
Football,10-Jan 17:00,France National 3,Colomiers v FC Alberes Argeles
Football,10-Jan 17:00,France National 3,Stade Lavallois II v Guingamp II
Football,10-Jan 17:00,France National 3,Dijon FCO II v Vierzon
Football,10-Jan 17:00,France National 3,Drancy v OSC Lille II
Football,10-Jan 17:00,France National 3,Agde v US Castanet
Football,10-Jan 17:00,France National 3,Ergue Gaberic v GSI Pontivy
Football,10-Jan 17:00,Spain Tercera Division,Atletico Arteixo v Celtiga
Football,10-Jan 17:00,France National 2,Nimes Olympique v ASF Andrezieux
Football,10-Jan 17:00,Italy Serie A,AS Roma v Sassuolo
Football,10-Jan 17:00,France National 2,Goal FC v AS Cannes
Football,10-Jan 17:00,Cyprus Division 1,APOEL Nicosia v Akritas Chlorakas
Football,10-Jan 17:00,France National 2,Sporting Toulon Var v Frejus St-Raphael
Football,10-Jan 17:00,France National 2,FC Rousset SVO v Hyeres
Football,10-Jan 17:00,France National 2,Angouleme v Locmine St-Colomban
Football,10-Jan 17:00,France National 2,RC Grasse v Limonest
Football,10-Jan 17:00,France National 2,US Saint-Malo v Lorient II
Football,10-Jan 17:00,France Cup,Le Puy v Reims
Football,10-Jan 17:00,France National 2,Saumur v Dinan Lehon
Football,10-Jan 17:00,France National 2,Bordeaux v Bayonne
Football,10-Jan 17:00,Egypt League Cup,Kahrabaa Ismailia v Al Masry
Football,10-Jan 17:00,France National 3,Club Municipal Sportif Oissel Football v Havre Caucriauville Sportif
Football,10-Jan 17:00,Cyprus Division 1,Aris Limassol v AEK Larnaca
Football,10-Jan 17:00,Spain Tercera Division,CD Arcangel San Miguel v UD Las Palmas III
Football,10-Jan 17:00,Spain Tercera Division,SD Revilla v SD Torina
Football,10-Jan 17:00,Netherlands Derde Divisie,SV Meerssen 1918 v Roosendaal
Football,10-Jan 17:30,Spain Tercera Division,Derio v Zarautz KE
Football,10-Jan 17:30,Greece Super League,Panaitolikos v PAOK
Football,10-Jan 17:30,England Women's Championship,Southampton Women v Portsmouth F.C. Women
Football,10-Jan 17:30,Spain Primera RFEF Group 1,Real Aviles v Pontevedra
Football,10-Jan 17:30,Spain Tercera Division,CD Villegas v Comillas CF
Football,10-Jan 17:30,Spain Primera Division,Girona v Osasuna
Football,10-Jan 17:30,Spain Tercera Division,CD Berceo v CD Autol
Football,10-Jan 17:30,Spain Segunda Division,Las Palmas v Deportivo La Coruna
Football,10-Jan 17:30,Germany Bundesliga 1,Bayer Leverkusen v Stuttgart
Football,10-Jan 17:30,Spain Segunda Division,CD Burgos v Eibar
Football,10-Jan 17:30,Spain Primera RFEF Group 1,CD Guadalajara v Cacereno
Football,10-Jan 17:30,Spain Tercera Division,Derio v Zarautz KE
Football,10-Jan 17:30,Greece Super League,Atromitos v Olympiakos
Football,10-Jan 17:30,Spain Tercera Division,SD Oyonesa v CD Varea
Football,10-Jan 17:30,Israel Premier League,Beitar Jerusalem v Maccabi Bnei Reiyne
Football,10-Jan 17:30,England National League,Braintree Town v Boston United FC
Football,10-Jan 17:30,Saudi Arabia Pro League,Al-Akhdoud (KSA) v Al Ahli Jeddah (KSA)
Football,10-Jan 17:45,Netherlands Eredivisie,FC Twente Enschede v PEC Zwolle
Football,10-Jan 17:45,Spain Tercera RFEF Women,Tolosa CF Women v Athletic Club Bilbao Women II
Football,10-Jan 17:45,England FA Cup,Tottenham Hotspur v Aston Villa
Football,10-Jan 17:45,England FA Cup,Grimsby Town v Weston Super Mare
Football,10-Jan 17:45,England FA Cup,Bristol City v Watford
Football,10-Jan 17:45,England FA Cup,Cambridge United v Birmingham City
Football,10-Jan 18:00,France National 2,Bourges Foot 18 v US Thionville Lusitanos
Football,10-Jan 18:00,Spain Tercera Division,Arenas de Armilla CD v UD San Pedro
Football,10-Jan 18:00,France National 2,FC de Chambly-Thelle v Entente Feignies Aulnoye FC
Football,10-Jan 18:00,France National 2,FC Bastia-Borgo v Colmar
Football,10-Jan 18:00,Brazil Brasiliense,Paranoa v Aruc DF
Football,10-Jan 18:00,Israel Liga Alef North,Hapoel Migdal Haemeq v Maccabi Kiryat Ata Bialik
Football,10-Jan 18:00,Spain Tercera Division,Real Sociedad C v Anorga
Football,10-Jan 18:00,Spain Primera Division Women,FC Barcelona Women v Madrid CCF Women
Football,10-Jan 18:00,Israel Liga Bet,Hapoel Ihoud Bnei Jat v FC Or Akiva
Football,10-Jan 18:00,Israel Liga Bet,Hapoel Ihoud Bnei Jat v FC Or Akiva
Football,10-Jan 18:00,Israel Liga Alef North,Hapoel Migdal Haemeq v Maccabi Kiryat Ata Bialik
Football,10-Jan 18:00,Segunda RFEF - Group 3 Women),CFF Caceres II Women v Sporting de Huelva Women
Football,10-Jan 18:00,Spain Tercera Division,San Bartolome v Tenerife C
Football,10-Jan 18:00,Israel Premier League,Hapoel Beer Sheva v Maccabi Haifa
Football,10-Jan 18:00,Spain Segunda B2,SD Logrones v Deportivo Alaves II
Football,10-Jan 18:00,Belgium Super League (women),Standard de Liege Women v KRC Genk Women
Football,10-Jan 18:00,Brazil Paulista A1,Sao Bernardo v Capivariano
Football,10-Jan 18:15,Brazil Sao Paulo Youth Cup,Comercial FC Tiete U20 v Criciuma EC U20
Football,10-Jan 18:15,Brazil Sao Paulo Youth Cup,Uniao Mogi SP U20 v Fortaleza U20
Football,10-Jan 18:15,Brazil Sao Paulo Youth Cup,Paulinia FC U20 v Vila Nova FC Goiania U20
Football,10-Jan 18:15,Brazil Sao Paulo Youth Cup,Aster Itaqua U20 v Nautico U20
Football,10-Jan 18:15,Brazil Sao Paulo Youth Cup,Guaratingueta U20 v Juventude U20
Football,10-Jan 18:15,Brazil Sao Paulo Youth Cup,Cosmopolitano Sports SP U20 v Figueirense FC Florianopolis U20
Football,10-Jan 18:15,Brazil Sao Paulo Youth Cup,Referencia Futebol Clube U20 v Real SC RS U20
Football,10-Jan 18:15,Israel Liga Alef South,Maccabi Yavne v Hapoel Herzliya
Football,10-Jan 18:30,Belgium First Amateur Division,Dessel Sport v Diegem Sport
Football,10-Jan 18:30,Gibraltar Premier Division,FCB Magpies v Glacis Utd
Football,10-Jan 18:30,Italy Serie B,Cesena v Empoli
Football,10-Jan 19:00,Brazil Catarinense 1 Division,Figueirense v Marcilio Dias
Football,10-Jan 19:00,Brazil Brasiliense,Ceilandia Esporte Clube v Sobradinho
Football,10-Jan 19:00,Brazil Brasiliense,Brasiliense v Brasilia DF
Football,10-Jan 19:00,Brazil Goiano 1,Atletico Goianiense v Anapolis FC
Football,10-Jan 19:00,Brazil Baiano 1 Division,Vitoria BA v Atletico BA
Football,10-Jan 19:00,Brazil Goiano 1,Abecat Ouvidorense v Vila Nova FC Goiania
Football,10-Jan 19:00,Brazil Potiguar 1 Division,America RN v Potyguar CN
Football,10-Jan 19:00,Brazil Alagoano,CRB Maceio v CSE AL
Football,10-Jan 19:00,Belgium First Amateur Division,K Lyra Lierse Berlaar v Belisia Bilzen SV
Football,10-Jan 19:00,Brazil Alagoano,Penedense v Cruzeiro AL
Football,10-Jan 19:00,Belgium Second Amateur Division - VFV A,Mandel United v Sparta Petegem
Football,10-Jan 19:00,Belgium First Amateur Division,Excelsior Virton v RSC Habay La Neuve
Football,10-Jan 19:00,Brazil Brasiliense,Ceilandia Esporte Clube v Sobradinho
Football,10-Jan 19:00,Belgium First Amateur Division,Braine v RAEC Mons
Football,10-Jan 19:00,Africa Cup Of Nations,Egypt v Ivory Coast
Football,10-Jan 19:00,Brazil Sergipano,Desportiva Aracaju v Confianca SE
Football,10-Jan 19:00,Brazil Alagoano,CRB Maceio v CSE AL
Football,10-Jan 19:00,Netherlands Eredivisie,PSV Eindhoven v Excelsior
Football,10-Jan 19:00,Belgium First Amateur Division,RFC Meux v Royal Union Saint-Gilloise II
Football,10-Jan 19:00,Brazil Mineiro 1,Uberlandia v Tombense
Football,10-Jan 19:00,Brazil Goiano 1,Atletico Goianiense v Anapolis FC
Football,10-Jan 19:00,Brazil Gaucho 1 Division,Juventude v Ypiranga
Football,10-Jan 19:00,Brazil Alagoano,Penedense v Cruzeiro AL
Football,10-Jan 19:00,Brazil Paranaense,Operario PR v Metropolitano Maringa
Football,10-Jan 19:00,Segunda RFEF - Group 3 Women),Atletico Malaga Women v CF Union Viera Women
Football,10-Jan 19:15,Brazil Sao Paulo Youth Cup,Maruinense U20 v Independente FC U20
Football,10-Jan 19:30,Brazil Matogrossense,Nova Mutum EC v Sport Sinop
Football,10-Jan 19:30,Brazil Cearense 1,Floresta EC v Ceara
Football,10-Jan 19:45,Brazil Sao Paulo Youth Cup,Aguia de Maraba U20 v Estrela de Marco U20
Football,10-Jan 19:45,Italy Serie A,Atalanta BC v Torino
Football,10-Jan 20:00,Brazil Pernambucano,Jaguar v Sport Recife
Football,10-Jan 20:00,Brazil Alagoano,ASA AL v Murici Futebol Clube
Football,10-Jan 20:00,Spain Primera Division,Valencia v Elche CF
Football,10-Jan 20:00,Spain Segunda Division,Real Racing Club Santander v Real Zaragoza
Football,10-Jan 20:00,Brazil Matogrossense,CE Operario Varzea-Grandense (CEOV) v Varzea Grande
Football,10-Jan 20:00,Spain Primera RFEF Group 1,Ponferradina v Ourense CF
Football,10-Jan 20:00,Brazil Matogrossense,Primavera MT v Chapada
Football,10-Jan 20:00,England FA Cup,Charlton Athletic v Chelsea
Football,10-Jan 20:00,France Cup,FC Sochaux v Lens
Football,10-Jan 20:00,Portugal League Cup,Guimaraes v Braga
Football,10-Jan 20:00,Netherlands Eredivisie,Groningen v NAC Breda
Football,10-Jan 20:15,Brazil Sao Paulo Youth Cup,America FC Rio de Janeiro U20 v Quixada FC U20
Football,10-Jan 21:00,Brazil Matogrossense,Mixto v Uniao MT
Football,10-Jan 21:00,Brazil Paulista A2,CA Votuporanguense v Agua Santa
Football,10-Jan 21:00,Brazil Paulista A2,Gremio Prudente v Ituano (SP)
Football,10-Jan 21:00,Brazil Sergipano,Lagarto v Falcon
Football,10-Jan 21:00,Brazil Matogrossense,Mixto v Uniao MT
Football,10-Jan 21:00,Argentina Torneo Federal,Fundacion Amigos por el Deporte v CA Argentino de Mendoza
Football,10-Jan 21:15,Brazil Goiano 1,Jataiense v CRAC
Football,10-Jan 21:30,Brazil Baiano 1 Division,Porto BA v Esporte Clube Jacuipense
Football,10-Jan 21:30,Brazil Paranaense,Coritiba v Londrina
Football,10-Jan 21:30,Brazil Paulista A1,Guarani SP v Esporte Clube Primavera
Football,10-Jan 21:30,Brazil Sao Paulo Youth Cup,Real Soccer U20 v Sao Paulo U20
Football,10-Jan 21:30,Mexico Segunda Division,Cordobes FC v Zitacuaro
Football,10-Jan 21:30,Brazil Mineiro 1,Cruzeiro v Pouso Alegre
Football,10-Jan 21:30,Brazil Mineiro 1,Itabirito v EC Democrata GV
Football,10-Jan 21:45,Brazil Sao Paulo Youth Cup,Uniao EC Mato Grosso U20 v QFC RN U20
Football,10-Jan 21:45,Mexico Liga MX Femenil,Cruz Azul Women v CD Guadalajara Women
Football,10-Jan 22:00,Brazil Paulista A2,Sertaozinho v EC Taubate
Football,10-Jan 22:00,Brazil Cearense 1,Quixada FC v Maracana EC
Football,10-Jan 22:00,Brazil Gaucho 1 Division,Guarany de Bage v Monsoon
Football,10-Jan 22:00,Brazil Matogrossense,Luverdense v Cuiaba
Football,10-Jan 22:00,Brazil Sao Paulo Youth Cup,Taubate U20 v Botafogo FR U20
Football,10-Jan 22:00,Trinidad and Tobago TT Premier Football League,Central FC v Police FC
Football,10-Jan 22:00,Trinidad and Tobago TT Premier Football League,La Horquetta Rangers FC v Police FC
Football,10-Jan 22:30,Brazil Catarinense 1 Division,Barra SC v Joinville Esporte Clube
Football,10-Jan 22:30,Brazil Brasiliense,SE do Gama v Real FC
Football,10-Jan 22:30,Brazil Amazonense 1 Division,Amazonas AM v Sao Raimundo AM
Football,10-Jan 22:30,Brazil Maranhense 1,SD Imperatriz v Sampaio Correa MA
Football,10-Jan 23:00,Mexico Liga MX Femenil,CF Tigres de la UANL Women v Puebla Women
Football,10-Jan 23:00,Club Friendly,Deportivo Cali v Once Caldas
Football,10-Jan 23:06,Mexico Liga MX Femenil,FC Juarez Women v Leon Women
Football,10-Jan 23:07,Mexico Liga MX,Chivas Guadalajara v CF Pachuca
Football,10-Jan 23:30,Brazil Paulista A1,Portuguesa SP v Palmeiras
Football,10-Jan 23:30,Brazil Paulista A1,Portuguesa SP v Palmeiras
Football,10-Jan 23:30,Brazil Mineiro 1,URT v North EC
Football,11-Jan 00:00,Brazil Sao Paulo Youth Cup,Osasco Audax SP U20 v Clube Atletico Mineiro U20
Football,11-Jan 00:00,Trinidad and Tobago TT Premier Football League,La Horquetta Rangers FC v Point Fortin FC
Football,11-Jan 00:00,Trinidad and Tobago TT Premier Football League,Prisons FC v Point Fortin FC
Football,11-Jan 00:00,Italy Lega Pro Prima Divisione Girone B,Rimini v Vis Pesaro
Football,11-Jan 00:00,Brazil Gaucho 1 Division,Avenida v Gremio
Football,11-Jan 00:00,Club Friendly,Independiente v Alianza Lima
Football,11-Jan 01:00,Mexico Liga MX,Club Leon v Cruz Azul
Football,11-Jan 01:00,Mexico Liga MX,Club Santos Laguna v Club Necaxa
Football,11-Jan 01:00,Mexico Liga de Ascenso,Cancun FC v Dorados
Football,11-Jan 01:00,Mexico Liga de Ascenso,Tepatitlan FC v Atlante
Football,11-Jan 01:00,Mexico Liga de Ascenso,Atletico Morelia v Correcaminos UAT
Football,11-Jan 02:00,Australia A-League,Wellington Phoenix v Adelaide United
Football,11-Jan 03:00,Mexico Liga MX,CF Monterrey v Toluca
Football,11-Jan 03:06,Mexico Liga MX Femenil,Club Tijuana Women v Club America Mexico Women
Football,11-Jan 05:00,Hong Kong Division 1,Hoi King SA v Metro Gallery Sun Source
Football,11-Jan 05:30,Hong Kong Division 1,Citizen AA v Kwun Tong FA
Football,11-Jan 05:30,Hong Kong Division 1,Wofoo Social Enterprises v Shatin SA
Football,11-Jan 06:00,Australia A-League,Melbourne City v Newcastle Jets
Football,11-Jan 06:00,Australia A-League Women,Melbourne Victory Women v Brisbane Roar Women
Football,11-Jan 07:00,Hong Kong Division 1,Resources Capital v Bright Cerulean FC
Football,11-Jan 07:30,Hong Kong Division 1,Lucky Mile v Central & Western District
Football,11-Jan 07:30,Hong Kong Division 1,Tun Sing FC v Sham Shui Po
Football,11-Jan 08:00,Kenya Super League,Kibera Black Stars v Luanda Villa SC
Football,11-Jan 08:00,South Africa Diski Challenge,Sekhukhune United U23 v Mamelodi Sundowns Reserves
Football,11-Jan 08:00,Cyprus Women's First Division,Olympiakos Nicosia WFC Women v Lakatamia FC Women
Football,11-Jan 08:00,Liga Nusantara,PSDS Deli Serdang v Nusantara United
Football,11-Jan 08:30,Indonesia Liga 1,Persib Bandung v Persija Jakarta
Football,11-Jan 08:30,Indonesia Liga 1,Arema Malang v Persik Kediri
Football,11-Jan 08:30,Indonesia Liga 1,Semen Padang v Persis Solo
Football,11-Jan 08:30,Indonesia Liga 1,Semen Padang v Persis Solo
Football,11-Jan 08:30,Hong Kong Premier League,Hong Kong FC v Kitchee SC
Football,11-Jan 09:00,Thailand T3,Rajpracha v Stk Muangnont FC
Football,11-Jan 09:00,Malaysia Super League,Penang FA v Melaka FC
Football,11-Jan 09:00,Thailand T3,Maejo United v Nakhonmaesot United
Football,11-Jan 09:00,Spain Tercera RFEF Women,ADC Puntal (women) v Athletic Club de Murcia Women
Football,11-Jan 09:00,Thailand T3,Udon United v Surin Khong Chee Mool FC
Football,11-Jan 09:00,Thai League 3,North Bangkok College FC v Royal Thai Air Force FC
Football,11-Jan 09:00,Thai League 3 - East,Marines Eureka v ACDC FC
Football,11-Jan 09:00,Thailand T3,MH Khon Surat City v Chumphon United
Football,11-Jan 09:00,Thailand T3,Muang Loei United v Ubon Ratchathani FC
Football,11-Jan 09:30,Hong Kong Division 1,South China v Yuen Long District SA
Football,11-Jan 09:30,Club Friendly,Podbrezova v FK Pohronie
Football,11-Jan 09:30,Spain Tercera RFEF Women,Oiartzun KE Women v Arratia CD Women
Football,11-Jan 10:00,Turkey Division 3/1,Cankaya FK v Inegol Kafkas
Football,11-Jan 10:00,Turkey Division 3/2,Osmaniyespor 2011 v Mazidagi Fosfatspor
Football,11-Jan 10:00,Turkey Division 3/3,Zonguldak Komurspor v Tokat Belediye Plevnespor
Football,11-Jan 10:00,Turkey Division 3/3,Orduspor 1967 v Artvin Hopaspor
Football,11-Jan 10:00,Campionato Primavera 1,Fiorentina U20 v Juventus U20
Football,11-Jan 10:00,Turkey Division 3/4,Afjet Afyonspor v Karsiyaka
Football,11-Jan 10:00,Thai League 3 - East,Customs United v BFB Pattaya City
Football,11-Jan 10:00,Turkey Division 2 Beyaz,Beykoz Anadolu v Sanliurfaspor
Football,11-Jan 10:00,Italy Eccellenza,ASD Citta di Anagni v Terracina
Football,11-Jan 10:00,Turkey Division 3/3,Sebat Genclikspor v Karadeniz Eregli Bld
Football,11-Jan 10:00,Spain Tercera RFEF Women,Real Zaragoza Women v SD Ejea Women
Football,11-Jan 10:00,Turkey Division 2 Kirmizi,Aksarayspor v 1461 Trabzon FK
Football,11-Jan 10:00,Italy Eccellenza,Quarto 2012 v S.Antonio Abate
Football,11-Jan 10:00,Malta Premier League,Gzira United v Zabbar St Patrick
Football,11-Jan 10:00,Club Friendly,Nk Lokomotiva Zagreb v Odra Opole
Football,11-Jan 10:00,Turkey Division 2 Beyaz,Inegolspor v Batman Petrolspor
Football,11-Jan 10:00,Andorra Copa Constitucio,Penya Ciutadella Esportivo v FC Rangers
Football,11-Jan 10:00,Thai League 3 - East,Customs United v BFB Pattaya City
Football,11-Jan 10:00,Turkey Division 3/2,Agri 1970 Spor v Kirikkale Buyuk
Football,11-Jan 10:00,Italy Eccellenza,ASD Citta di Anagni v Terracina
Football,11-Jan 10:00,Campionato Primavera 1,Cesena FC U20 v Genoa U19
Football,11-Jan 10:00,Spain Tercera RFEF Women,Real Zaragoza Women v SD Ejea Women
Football,11-Jan 10:00,Turkey Division 3/4,Afjet Afyonspor v Karsiyaka
Football,11-Jan 10:00,Italy Eccellenza,Quarto 2012 v S.Antonio Abate
Football,11-Jan 10:00,Kenya Women's Premier League,Kisumu All Starlets Women v Vihiga Queens FC Women
Football,11-Jan 10:00,Spain Tercera Division,San Ignacio v Touring KE
Football,11-Jan 10:00,Club Friendly,Botosani v Farul Constanta
